850,109/10/25,6674,鋐寶科技,－ ,通信網路業,新竹縣竹北市台元一街1號13樓之一,24456541,翁宗斌,王昱賀,林津佩,財會暨股務部資深經理,邱紹揚,(03)5600066,20090819,20181128,新台幣                 10.0000元,668870910,0,0,1,中國信託商業銀行 代理部,(02)23111838,台北市中正區重慶南路一段83 號5 樓,安侯建業聯合會計師事務所,簡思娟,郭冠纓,CBN,"13F,-1, No.1, Taiyuan 1st St.,Zhubei City, Hsinchu County, Taiwan",(03)5600060,Investor@compalbn.com,http://www.icbn.com.tw/,上市,研究、開發及銷售智慧閘道器、數位機上盒及無線寬頻分享器等通訊產品。,2018/11/28
851,109/10/25,6698,旭暉應材,－ ,其他電子業,台南市安南區工業一路36號,28722767,趙勤孝,趙勤孝,李芳春,財務長,黃信貿,06-6016388,20070525,20191125,新台幣                 10.0000元,663897530,0,0,1,兆豐證券股份有限公司,02-33930898,台北巿中正區忠孝東路二段95號1 樓,資誠聯合會計師事務所,林姿妤,劉子猛,FINEMAT,"No.36,Gongye 1st Rd.,Annan DistrictTainan City,Taiwan",06-3842599,ir@fine-mat.com,www.fine-mat.com,上市,高精細金屬遮罩製作銷售精密洗淨及再生處理,2019/11/25
852,109/10/25,6706,惠特,－ ,光電業,台中市西屯區工業區35路3號,70697332,徐秋田,徐秋田,羅儷英,財務經理,王郁喬,04-23502319,20000125,20191219,新台幣                 10.0000元,671779350,0,0,1,凱基證券股份有限公司股務代理部,02-23892999,台北市重慶南路一段二號5樓,勤業眾信聯合會計師事務所,陳慧銘,謝明忠,FitTech,NO.35　3TH　ROAD.　INDUSTRIAL　PARK. N.RD HSINCHU INDUSTRIAL PARKTAICHUNG　TAIWAN　R.O.C.,04-23504502,service-investor@fittech.com.tw,http://www.fittech.com.tw/,上市,點測機及分選機設備製造雷射精密機械設備製造LED晶粒點測及分類代工,2019/12/19
853,109/10/25,6715,嘉基,－ ,電子零組件業,新北市中和區連城路268號2樓之1,53431627,朱德祥,羅偉仁,朱祖琪,財務長,廖健谷,02-8226-5880,20110822,20191212,新台幣                 10.0000元,570000000,0,0,1,中國信託商業銀行代理部,02-2311-1838,台北市中正區重慶南路一段83號5樓,勤業眾信聯合會計師事務所,簡明彥,莊碧玉,Lintes,"2F.-1, No.268, Liancheng Rd., Zhonghe Dist.New Taipei City 235, Taiwan (R.O.C.)",02-8226-5882,eric.chu@lintestech.com,www.lintestech.com,上市,高速電/光傳輸線及連接器相關產品之研發、生產與銷售,2019/12/12
854,109/10/25,6754,匯僑設計,－ ,其他,台北市松山區南京東路四段75號12樓,24775812,王秀卿,楊信力,羅月華,財務長,張敏慧,(02)2545-6011,20141209,20200825,新台幣                 10.0000元,660000000,0,0,1,凱基證券股務代理部,02-2389-2999,台北市重慶南路一段2號5樓,勤業眾信聯合會計師事務所,呂宜真,陳慧銘,Rich Honour,"12F., No. 75, Sec. 4, Nanjing E. Rd., Songshan Dist.,Taipei City 105, Taiwan (R.O.C.)",(02)2545-2126,IR@richhonour.com,www.richhonour.com,,,
855,109/10/25,8011,台通,－ ,通信網路業,新北市新莊區五權三路12巷3號,12362365,李慶煌,李慶煌,陸秀芳,財務長,鄭全斌,(02)2299-1066,19811221,20110919,新台幣                 10.0000元,1175803750,0,0,1,日盛證券股份有限公司,(02)2541-9977,台北市中山區南京東路二段85號7樓,勤業眾信聯合會計師事務所,陳盈州,陳麗琦,TTCC,"No.3, Lane 12,Wuquan 3rd RoadXinzhuang District, New Taipei City ,ROC",(02)8990-2219,fnc@ttcc.com.tw,www.ttcc.com.tw,上市,通信網路相關產品工程收入,2011/09/19
856,109/10/25,8016,矽創,－ ,半導體業,新竹縣竹北市台元一街5號11樓之1,86735240,毛穎文,王崴,周德雲,資深處長,毛廷方,03-5526500,19920709,20031225,新台幣                 10.0000元,1201368760,0,0,1,台新國際商業銀行股務代理部,02-25048125,台北市建國北路一段96號地下一樓,勤業眾信聯合會計師事務所,林政治,黃裕峰,Sitronix　　,"11F-1, No.5, Taiyuan 1st St.,Jhubei City, Hsinchu County 302, Taiwan",03-5526501,spokesperson@sitronix.com.tw,http://www.sitronix.com.tw,上市,"各種積體電路之設計,製造,測試及銷售各種積體電路模組之設計,製造,測試及銷售各種積體電路應用軟體之研究,開發及銷售",2003/12/25
857,109/10/25,8021,尖點,－ ,其他電子業,新北市樹林區佳園路三段203號,96912835,林序庭,林序庭(暫代),林若萍,管理中心 總經理,蔡依礽,(02)26805868,19960412,20080121,新台幣                 10.0000元,1421804670,0,0,1,福邦證券股份有限公司,(02)2371-1658,10041台北市中正區忠孝西路一段6號6樓,勤業眾信聯合會計師事務所,陳招美,謝建新,Topoint　　,"No.203,Sec.3,Jiayuan Rd.,Shulin District,New Taipei City,Taiwan,R.O.C.　　",(02)26807588,IR@topoint.tw,http://www.topoint.tw/,上市,電子線路板專用微型鑽針及銑刀之產銷電子線路板製程加工電腦數值控制工具機專用切削刀具及加工週邊設備之產銷,2008/01/21
858,109/10/25,8028,昇陽半導體,－ ,半導體業,新竹科學園區新竹市力行路6號,84149884,楊敏聰,蔡幸川,黃豐年,副總經理,戴文玲,03-5641888,19970303,20180710,新台幣                 10.0000元,1324080000,0,0,1,福邦證券股份有限公司股務代理部,(02)2371-1658,台北市中正區忠孝西路一段6號6樓,資誠聯合會計師事務所,李典易,謝智政,PSI　　,"No.6, Li-Hsin Road, Science- Park.Hsinchu 300 Taiwan, R.O.C.",03-5670888,fnhuang@psi.com.tw,www.psi.com.tw,上市,再生晶圓、半導體中段製程服務、微機電製程代工動力儲能鋰電池之研發、設計與製造,2018/07/10
859,109/10/25,8033,雷虎,－ ,其他,台中巿工業區六路七號,52541175,陳冠如,蘇聖傑,曾俊明,主任秘書,卓宜儒,04-23591616,19791002,20070621,新台幣                 10.0000元,1126297750,7672502,0,1,凱基證券股份有限公司,02-23892999,台北巿重慶南路一段二號五樓,國富浩華聯合會計師事務所,林明壽,蘇炳章,TT,"NO.7, 6TH ROAD INDUSTRY PARK TAICHUNGTAICHUNG, TAIWAN R.O.C. 40755",04-23591902,tt@thundertiger.com,www.thundertiger.com,上市,無線電遙控產品─各種科學模型飛機、車、船、直昇機及其零配件如引擎等製造與買賣無線電相關電子產品製造與買賣,2007/06/21
860,109/10/25,8039,台虹,－ ,電子零組件業,高雄市前鎮區高雄加工出口區環區三路一號,16198345,孫達汶,顏志明,謝芳宜,財務長,張啟訓,07-8139989,19970816,20091217,新台幣                 10.0000元,2091196920,0,0,1,元大證券股份有限公司,02-25865859,台北市承德路三段210號B1樓,安永聯合會計師事務所,李芳文,陳政初,TAIFLEX　,"No.1, Huanqu 3rd Rd., Kaohsiung Export Processing Zone,Kaohsiung City, Taiwan, R.O.C.",07-8159463,shieh@taiflex.com.tw,www.taiflex.com.tw,上市,高分子薄膜銅箔積層板保護膠片,2009/12/17
861,109/10/25,8046,南電,－ ,電子零組件業,桃園市蘆竹區南崁路一段338號,16096804,吳嘉昭,湯安得,呂連瑞,副總經理,江文楓,03-3223751,19971028,20060407,新台幣                 10.0000元,6461654870,0,0,1,南亞電路板股份有限公司股務科,02-27189898,台北市敦化北路201號,安侯建業聯合會計師事務所,寇惠植,李慈慧,N.P.C,"No. 338,Sec.1 Nankan Rd.,Luchu Dist., Taoyuan City, Taiwan",03-3218470,nanya@nanyapcb.com.tw,www.nanyapcb.com.tw,上市,"CC01080電子零組件製造業CC01090電池製造業ZZ99999除許可業務外,得經營法令非禁止或限制之業務",2006/04/07
862,109/10/25,8070,長華*,－ ,電子通路業,高雄市楠梓加工出口區東七街16號6樓,23307811,黃嘉能,黃俊勳,楊琇如,行政副總經理,蘇雙富,07-3622663,19890513,20071231,新台幣                  1.0000元,638799370,0,0,1,永豐金證券股份有限公司,02-23816288,臺北市中正區博愛路17號3樓,勤業眾信聯合會計師事務所,劉裕祥,廖鴻儒,CHANG WAH,"6F,NO. 16 EAST 7th Street Nan-Tze Export. Processing Zone,　　KAOHSIUNG TAIWAN. R.O.C.　",07-3684393,richie.su@cwei.com.tw,www.cwei.com.tw,上市,半導體封裝材料之銷售封裝機器設備之買賣與安裝提供封裝技術服務,2007/12/31
863,109/10/25,8072,陞泰,－ ,電子通路業,台北市南港區三重路19-11號E棟10樓,97092770,陳世忠,陳世忠,陳世忠,總經理,林敏慧,2655-3866,19960626,20050819,新台幣                 10.0000元,800000000,0,0,1,中國信託商業銀行,02-66365566,台北市重慶南路一段83號6樓,勤業眾信會計師事務所,李振銘,郭文吉,AV TECH　,"10F,E BUILDING,NO.19-11,SAN CHUNG RD.,NANKANG, TAIPEI ,115,TAIWAN,R.O.C",5581-3499,lydia.lin@avtech.com.tw,www.avtech.com.tw,上市,監視防盜系統製造、按裝、銷售及進口貿易業務,2005/08/19
864,109/10/25,8081,致新,－ ,半導體業,新竹市科學園區工業東三路2號,84149723,謝南強,吳錦川,吳錦川,總經理,唐漢光,03-5788833,19960703,20081230,新台幣                 10.0000元,861720720,0,0,1,台新國際商業銀行股務代理部,02-25048125,台北市建國北路一段96號B1,資誠聯合會計師事務所,江采燕,謝智政,GMT,"No 2,Industry E. RD. III, Hsinchu Science  ParkHsinchu, 300 Taiwan, R.O.C.",03-5784289,ir@gmt.com.tw,http://www.gmt.com.tw,上市,研究.開發.生產.製造及銷售數位與類比混合IC及特殊應用IC,2008/12/30
865,109/10/25,8101,華冠,－ ,通信網路業,台北市內湖區瑞光路258巷2號7樓,70747852,李森田,周照程,周照程,總經理,吳樹永,02-26587718,19990824,20040701,新台幣                 10.0000元,2080887950,21114466,0,1,福邦證券股務代理部,(02)2371-1658,台北市中正區忠孝西路一段6號6樓,資信聯合會計師事務所,黃增國,戴至柔,Arima Comm.　　,"7F., No. 2, Lin. 258, Ruiguang Rd., Neihu Dist.,Taipei  City 11494,Taiwan",02-26589916,public@arimacomm.com.tw　　,www.arimacomm.com.tw,上市,無線通信機械器材之製造及銷售電信管制射頻器材之製造及銷售電子零組件之製造及銷售,2004/07/01
866,109/10/25,8103,瀚荃,－ ,電子零組件業,新北市淡水區中正東路一段3巷9號9樓,23632274,楊超群,竺大智,王霈蓮,資深副理,雷舜貽,26201000,19900316,20090929,新台幣                 10.0000元,789534130,0,0,1,華南永昌綜合證券(股)公司,27186425,台北巿民生東路四段54號4樓,安侯建業聯合會計師事務所,陳雅琳,蘇彥達,CviLux,"9F.,No.9,Lane 3,Sec.1,Chung-Cheng East Road,Tamshui,New Taipei City, Taiwan",26282333,apple.lei@cvilux.com,www.cvilux-group.com,上市,各種電子零件(連接器、電子線)等製造加工及買賣業務一般進出口貿易業務(許可業務除外)代理國內外廠商有關商品投標報價業務,2009/09/29
867,109/10/25,8104,錸寶,－ ,光電業,新竹縣湖口鄉新竹工業區光復北路12號,70766576,葉垂景,陳康,王鼎章,執行長,陳康,03-5989999,20000313,20190117,新台幣                 10.0000元,676300500,0,0,1,台新銀行(股)公司股務代理部,02-25048125,104台北市建國北路一段96號B1,安永聯合會計師事務所,鄭清標,羅筱靖,RiTdisplay,"No. 12,Kuanfu N. Road, Hsin Chu Industrial Park,Hsin Chu County, Taiwan 30351",03-5989688,invest@ritdisplay.com,http://www.ritdisplay.com,上市,有機電激發光顯示器〈OLED〉之製造加工及買賣業務,2019/01/17
868,109/10/25,8105,凌巨,－ ,光電業,苗栗縣頭份市蘆竹里4鄰工業路15號,16432742,田村隆幸,中村浩司,劉德齊,財務會計處處長,謝裕忠,(037)611611,19971215,20061227,新台幣                 10.0000元,4415448510,152981757,0,1,元大證券股份有限公司股務代理部,(02)2586-5859,103台北市大同區承德路三段210號B1,安侯建業聯合會計師事務所,陳宜君,江忠儀,GiantPlus,"No.15, Gongye Rd., Lu-Chu Li, Toufen CityMiaoli County, Taiwan, R.O.C.",(037)625622,ir@giantplus.com,www.giantplus.com,上市,"研發生產及銷售液晶顯示器(STN型及TFT型),液晶顯示面板及模組研發生產及銷售液晶顯示器測試儀器,液晶顯示器零組件,多晶片模組",2006/12/27
869,109/10/25,8110,華東,－ ,半導體業,高雄市高雄加工出口區北一路18號,22101116,焦佑衡,于鴻祺,潘靜儀,財務長暨副總經理,黃靖窈,07-8111330,19950406,20071031,新台幣                 10.0000元,5063811440,0,0,1,華東科技股份有限公司股務辦事處,02-27905885,台北市內湖區行善路398號8樓,勤業眾信會計師事務所,郭麗園,江佳玲,WALTON　,"18, North 1st Rd.,K.E.P.Z. Kaohsiung, Taiwan, R.O.C.",07-8111889,waltonir@walton.com.tw,www.walton.com.tw,上市,CC01080電子零組件製造業,2007/10/31
870,109/10/25,8112,至上,－ ,電子通路業,台北市內湖區港墘路189號7樓,22368959,葛均,葛均,林志隆,董事長室特別助理,陳力行,02-26578809,19870305,20071231,新台幣                 10.0000元,3784964730,0,0,1,群益金鼎證券股份有限公司,02-2702-3999,台北市大安區敦化南路二段97號地下二樓,安侯建業聯合會計師事務所,余聖河,陳振乾,Supreme　　,"7 F, No. 189, Kangchien Rd., Nei-Hu,　Taipei, Taiwan",02-26572209,jason@supreme.com.tw,www.supreme.com.tw,上市,電子零組件經銷業務,2007/12/31
871,109/10/25,8114,振樺電,－ ,電腦及週邊設備業,新北市土城區大同街23號,12514341,陳茂強,陳茂強,徐瑞妤,協理,顏佳怡,02-2268-5577,19840811,20121126,新台幣                 10.0000元,1060749190,0,31153147,1,元大證券股務代理部,02-2586-5859,台北市承德路三段210號B1樓,安侯建業聯合會計師事務所,于紀隆,陳蓓琪,POSIFLEX,"No.23, Datong St., Tucheng Dist.New Taipei City 236, Taiwan (R.O.C.)",02-2268-5388,ir@posiflex.com.tw,www.posiflex.com.tw,上市,端點銷售管理系統(POS)及其週邊設備和服務資訊服務系統整體解決方案,2012/11/26
872,109/10/25,8131,福懋科,－ ,半導體業,雲林縣斗六市榴中里河南街329號,23826736,王文淵,謝式銘,張憲正,執行副總經理,陳文才,05-5574888,19900911,20071129,新台幣                 10.0000元,4422222230,0,0,2,福懋科技股份有限公司股務科,02-27189898,台北市敦化北路201號後棟一樓,資誠聯合會計師事務所,吳漢期,梁華玲,　　FATC,"NO.329,Ho-Nan St.　Toulin, Taiwan, R.O.C.",05-5574859,y0222@fatc.com.tw,http://www.fatc.com.tw,上市,接受委託各型積體電路之封裝、測試與模組之加工及研究開發業務CC01080電子零組件製造業,2007/11/29
873,109/10/25,8150,南茂,－ ,半導體業,新竹科學園區新竹縣研發一路一號,16130042,鄭世杰,鄭世杰,黃國樑,副總經理,蘇郁姣,03-5770055,19970728,20140411,新台幣                 10.0000元,7272401260,0,0,1,凱基證券股份有限公司股務代理部,02-23892999,(100)臺北市重慶南路一段2號5樓,資誠聯合會計師事務所,徐建業,梁益彰,ChipMOS　　,"No.1 R&D Rd.1,Hsinchu Science Park　Hsinchu,Taiwan,R.O.C　",03-5668981,vicki_lin@chipmos.com,www.chipmos.com,上市,研究開發生產製造銷售高集積度高精密度記憶體之封裝及測試服務LCD驅動IC封裝測試業務,2014/04/11
874,109/10/25,8163,達方,－ ,電腦及週邊設備業,桃園市龜山區山鶯路167-1號,16081507,蘇開建,蔡耀坤,林獻章,副總經理,林豐正/蘇柏翰,03-2508800,19970508,20071128,新台幣                 10.0000元,2800000010,0,0,1,台新國際商業銀行股務代理部,(02)25048125,臺北市建國北路一段96號B1,安侯建業聯合會計師事務所,張惠貞,施威銘,DARFON,"167-1 Shan-ying Road, GueishanTaoyuan 333, Taiwan, R.O.C.",03-3592291,INVESTOR@DARFON.COM.TW,WWW.DARFON.COM.TW,上市,電子零組件電腦週邊產品,2007/11/28
875,109/10/25,8201,無敵,－ ,其他電子業,台北市內湖區瑞光路513巷36號10樓,23163259,楊人捷,李圍正,李圍正,總經理,高貴梅,77265111,19890217,20071029,新台幣                 10.0000元,623662750,0,0,1,台新國際商業銀行股務代理部,25048125,台北市建國北路一段96號B1,安侯建業聯合會計師事務所,連淑凌,林琬琬,BESTA　　,"10FL.,No.36,Lane 513,Rui Guang Road,Nei Hu Dist.,　　Taipei,Taiwan, R.O.C 　　",77267333,lilycheng@besta.com.tw,http://www.besta.com.tw,上市,商品銷售其他收入,2007/10/29
876,109/10/25,8210,勤誠,－ ,電腦及週邊設備業,新北市新莊區中原路558號18樓,5143647,陳美琪,陳亞男,陳亞男,總經理,陳蘊芃,(02)8226-5500,19831205,20111201,新台幣                 10.0000元,1209259500,0,0,1,富邦綜合證券股份有限公司,(02)23611300,台北市許昌街17號2樓,資誠聯合會計師事務所,潘慧玲,林鈞堯,CHENBRO　,"18F., No.558,Zhongyuan Rd.,Xinzhuang Dist, New Taipei City Taiwan",(02)8226-5395,ir@chenbro.com,www.chenbro.com,上市,電腦應用軟體設計工程業務有關電腦用品及週邊設備之進出口貿易業務有關電腦週邊設備及其用品耗材主件系統之研展製造加工及買賣業務,2011/12/01
877,109/10/25,8213,志超,－ ,電子零組件業,桃園市平鎮區工業二路１２號,70801378,徐正民,李明熹,胡秀杏,財務處副總,林振旻,03-4698860,19980421,20091225,新台幣                 10.0000元,2712424880,0,0,1,凱基證券(股)公司股務代理部,02-23892999,台北市重慶南路一段２號５樓,安侯建業聯合會計師事務所,江忠儀,連淑凌,tpt,"NO.12, INDUSTRIAL 2 RD.,PINGZHEN DIST., TAOYUAN CITY 324, TAIWAN",03-4698277,ritahu@tpt-pcb.com.tw,www.tpt-pcb.com.tw,上市,CC01080電子零組件製造業。F219010電子材料零售業。F401010國際貿易業。,2009/12/25
878,109/10/25,8215,明基材,－ ,光電業,桃園市龜山區建國東路29號,16549778,陳建志,劉家瑞,王勝興,財務長,暫缺,(03)3748800,19980716,20101112,新台幣                 10.0000元,3206745140,0,0,1,台新國際商業銀行股務代理部,(02)2504-8125,台北市建國北路一段96號B1,安侯建業聯合會計師事務所,唐慈杰,施威銘,BMC,"29  Jianguo E. Road, GueishanTaoyuan 333, Taiwan, R.O.C.　",(03)3748884,IR@benqmaterials.com,www.benqmaterials.com,上市,電腦及週邊設備製造業其他化學材料製造業醫療產品製造業,2010/11/12
879,109/10/25,8222,寶一,－ ,電機機械,台南市新營區新工路13巷1號,4431804,曾國浩,曾國浩,胡淑賢,副總經理,謝舒萍,06-6535001,19741005,20150127,新台幣                 10.0000元,685735000,0,0,2,台新國際商業銀行股務代理部,02-25048125,10489 台北市建國北路一段96號地下一樓,勤業眾信聯合會計師事務所,李季珍,楊朝欽,Aero Win,"NO. 1, LN. 13, XINGONG  RD                                    　　XINYING DIST., TAINAN CITY, ROC 730",06-6535057,finance-1@aerowin.com,www.aerowin.com　　,上市,各型航空器及其零件之製造、修理及買賣業務航空合金材料及五金之買賣業務發電、輸電、配電機械及其零配件之製造及買賣業務,2015/01/27
880,109/10/25,8249,菱光,－ ,電子零組件業,台北市內湖區南京東路六段501號9樓,16596646,黃育仁,蔡元豪,歐聖志,財務處協理,陳鶴心,(02)89121289,19980615,20050517,新台幣                 10.0000元,1270550000,0,0,1,元大證券(股)公司股務代理部,(02)2586-5859,台北市承德路三段210號地下一樓,資誠聯合會計師事務所,張淑瓊,林鈞堯,CSI　　,"9th Floor, No. 501, Section 6 Nanjing East Road,Neihu District ,Taipei City, Taiwan",(02)89121111,spokesperson@csi-sensor.com.tw,www.csi-sensor.com.tw,上市,電子零組件製造業資料儲存及處理設備製造業有線通信機械器材製造業,2005/05/17
881,109/10/25,8261,富鼎,－ ,半導體業,新竹縣竹北市台元一街5號12樓之1及12樓之2,16550923,鄧富吉,鄧富吉,黃林鍾,執行副總經理,譚梅英,27940606,19980717,20091211,新台幣                 10.0000元,813404930,0,0,1,元大證券股份有限公司,25865859,台北市承德路三段210號地下一樓,勤業眾信聯合會計師事務所,李振銘,郭俐雯,　　APEC,"12F, No.5, Taiyuan 1st St., Zhubei CityHsinchu County, Taiwan, R.O.C.　",27940616,investinfo@a-power.com.tw,www.a-power.com.tw,上市,電子零組件製造業電子元件設計電子元件等電子測試服務,2009/12/11
882,109/10/25,8271,宇瞻,－ ,半導體業,新北市土城區大安里忠承路32號1樓,97444368,陳益世,張家騉,賴孜玟,財務長,張家騉,(02)22678000,19970416,20101229,新台幣                 10.0000元,1008978070,0,0,1,凱基證券(股)公司股務代理部,(02)2389-2999,台北市重慶南路1段2號5樓,安侯建業聯合會計師事務所,唐慈杰,陳玫燕,Apacer,"1F,No.32,Zhongcheng Rd.Tucheng Dist.,New Taipei City 236,Taiwan",(02)22673410,public@apacer.com,www.apacer.com,上市,記憶體模組快閃記憶體其他,2010/12/29
883,109/10/25,8341,日友,－ ,其他,雲林縣元長鄉元東路1之20號,89922041,張芳正,張芳正,楊希聖,副總,張永典,05-7885788,19941129,20150323,新台幣                 10.0000元,1115000000,0,0,1,第一金證券股份有限公司,02-2563-5711,10688台北市大安區安和路一段27號六樓,資誠聯合會計師事務所,王照明,李秀玲,SF　　,"NO.1-20,YUN-DUNG RD.,YUN-CHANG HSIANG　　YUNLIN HSIEN,TAIWAN,R.O.C　　",05-7887933,sf@mail.sunnyfriend.com.tw,http://www.sunnyfriend.com.tw/,上市,醫療廢棄物焚化處理，有害事業廢棄物焚化、物化、固化及掩埋處理一般事業廢棄物、垃圾、污泥及油泥焚化處理小型焚化爐設計、規劃及建造、承攬興建焚化廠或掩埋場,2015/03/23
884,109/10/25,8367,建新國際,－ ,航運業,台中市梧棲區臨港路3段68號,23250583,陳銀海,陳彥銘,柯勝鐘,副總經理,陳秀寶,0426399666,19890425,20180912,新台幣                 10.0000元,811319380,0,0,1,凱基證券股份有限公司,02-23892999,台北市重慶南路一段2號5樓,勤業眾信聯合會計師事務所,翁博仁,陳慧銘,CS　,"No.68, Sec. 3, Lingang Rd., Wuqi Dist.,Taichung City 435, Taiwan  R.O.C.　　",0426399555,cs-spokesman@chienshing.com.tw,www.chienshing.com.tw,上市,船舶裝卸業運輸業報關業,2018/09/12
885,109/10/25,8374,羅昇,－ ,電機機械,新北市三重區光復路一段83巷7號2樓,12486062,李昌鴻,陳文德,李長堅,營運長,陳國美,02-2995-8400,19840331,20081225,新台幣                 10.0000元,1122254870,23000000,0,1,元大證券(股)公司股務代理部,02-2586-5859,台北市大同區承德路3段210號B1,安侯建業聯合會計師事務所,施威銘,陳玫燕,ACE PILLAR,"2F, NO.7,  Lane 83,Sec 1,Kuang-Fu Road,San-Chung Dist, New Taipei City ,Taiwan",02-2999-3775,denise_chen@acepillar.com.tw,www.acepillar.com.tw,上市,變頻器/自動化驅動控制系統自動化傳動系列控制器及監控系統,2008/12/25
886,109/10/25,8404,百和興業-KY,KY 開曼群島                                                    ,其他,"P.O.BOX 32052,Grand Cayman KYI-1208,Cayman Islands.",26829193,鄭國火因,鄭國火因,張玉敏,會計經理,黃舒瓴,04-7561340,20061106,20110518,新台幣                 10.0000元,3151781260,0,0,1,中國信託商業銀行代理部,02-6636-5566,臺北市重慶南路一段83號5樓,勤業眾信聯合會計師事務所,蔣淑菁,蘇定堅,PAIHO  SHIH,"NO.575 HO KANG RD, HO MEI TOWNCHANG HUA COUNTY, ROC",04-7570670,f182@paiho.cn,https://www.paiho.cn/,上市,成衣、鞋類及運動用品之輔料黏扣帶、織帶(鞋帶)之產製及銷售成衣、鞋類及運動用品之鬆緊帶、針織緹花網布等材料之產製及銷售,2011/05/18
887,109/10/25,8411,福貞-KY,KY 開曼群島                                                    ,其他,"P. O. Box 31119 Grand Pavilion, Hibiscus Way, 802 West Bay R",10913602,李榮福,莊素貞,李毓嵐,執行副總經理,藍建中,0937-841198,20090826,20111101,新台幣                 10.0000元,1753981850,0,0,1,永豐金證券股份有限公司,02-2381-6288,台北市博愛路17號3樓,安侯建業聯合會計師事務所,黃泳華,陳振乾,KINGCAN,"P. O. Box 31119 Grand Pavilion, Hibiscus Way, 802 West Bay Road, Grand Cayman,Cayman Islands",04-23291439,spokesman@kchld.com,www.kingcanholdings.com,上市,馬口鐵罐製造與銷售,2011/11/01
888,109/10/25,8422,可寧衛,－ ,其他,高雄市岡山區中山南路308號1樓,16908140,楊慶祥,楊永發,陳聰田,財務長,洪秉承,07-6228422,19990504,20111005,新台幣                 10.0000元,1088880000,0,0,1,台新國際商銀(股)公司股務代理部,02-25048125,台北市建國北路一段96號地下一樓,勤業眾信聯合會計師事務所,施錦川,賴冠仲,Cleanaway,"1F., No.308, Zhongshan S. Rd., Gangshan Dist.,Kaohsiung City 820, Taiwan (R.O.C.)",07-6235977,8422@cleanaway.tw,http://www.cleanaway.tw,上市,有害事業廢棄物清除處理業務,2011/10/05
889,109/10/25,8427,基勝-KY,KY 開曼群島                                                    ,其他,新北市新店區民權路95號16樓,53013905,劉宗信,劉怡孝,曾獻正,總經理特別助理,林祐如,02-2219-2640,20100908,20111206,新台幣                 10.0000元,1042610000,0,0,1,兆豐證券股份有限公司股務代理部,02-3393-0898,台北市忠孝東路二段95號1樓,勤業眾信聯合會計師事務所,呂宜真,林宜慧,KEYSHEEN,"16F., No.95, Minquan Road.Xindian Dist., New Taipei City, R. O. C.",02-2219-8463,investor@keysheen.com,www.keysheen.com,上市,戶外休閒金屬傢俱相關製品設計、生產及銷售,2011/12/06
