404,109/10/25,2516,新建,－ ,建材營造,臺北市八德路四段760號15-16樓,11762504,鄒宏基,朱台森,陳柏仲,協理,陳相任,(02)2528-8008,19671204,19930525,新台幣                 10.0000元,2262784570,0,0,1,凱基證券(股)公司,(02)2389-2999,臺北市重慶南路一段二號五樓,安侯建業聯合會計師事務所,陳宗哲,張淑瑩,New Asia,"15-16Fl.,No.760,Sec.4,Bade Rd.,Sungshan Chiu,Taipei,Taiwan 105,R.O.C.",(02)2747-7473,stock@newasia.com.tw,http://www.newasia.com.tw/,上市,土木工程：承辦各種道路.橋樑.隧道.運河等土木工程建築工程：承辦各種辦公大樓.住宅.學校.廠房.醫院.運動館等工程工廠工程：核能電廠及各種工廠之建廠工程,1993/05/25
405,109/10/25,2520,冠德,－ ,建材營造,台北市大安區和平東路三段131號2樓,30900892,馬志綱,洪錦欽,張勝安,副總經理,張淑蓮,(02)2378-6789,19791123,19931027,新台幣                 10.0000元,5037910000,0,0,1,中國信託商業銀行代理部,(02)6636-5566,100台北市重慶南路一段83號5樓,安侯建業聯合會計師事務所,韓沂璉,簡蒂暖,KINDOM,"2F., No. 131, Sec. 3, Heping E. Rd., Da'an Dist.Taipei City , Taiwan (R.O.C.)",(02)2739-6710,grace_fan@kindom.com.tw,http://www.kindom.com.tw,上市,委託營造廠商興建國民住宅及商業大樓出租出售業務。建築傢具之買賣及進出口貿易業務。接受委託辦理都市更新土地重劃及房屋買賣資訊業務。,1993/10/27
406,109/10/25,2524,京城,－ ,建材營造,高雄市左營區博愛二路150號16樓,6667446,蔡天贊,陳添進,周敬恆,協理,陳瑞俐,07-5586368,19850913,19941018,新台幣                 10.0000元,3748463720,0,0,1,台新國際商業銀行股務代理部,02-25048125,台北市建國北路一段96號地下一樓,信永中和聯合會計師事務所,莊淑媛,張瑞玲,KTC,"16F., No.150, Bo'ai 2nd Rd., Zuoying Dist.Kaohsiung, Taiwan, R.O.C.",07-5572111,bruce@kingtown.com.tw,http://www.kingtown.com.tw/,上市,H701010住宅及大樓開發租售業。J901020一般旅館業。F501060餐館業。,1994/10/18
407,109/10/25,2527,宏璟,－ ,建材營造,台北市基隆路一段420號10樓,22344508,簡文祥,周家佩,簡文祥,董事長,"周家佩,陳芳瑩",2691-5899,19861219,19950306,新台幣                 10.0000元,2703060000,0,0,1,富邦綜合證券股份有限公司,23611300,北市100中正區許昌街17號2樓,勤業眾信會計師事務所,鄭旭然,林旺生,Hung Ching,"10th Fl., 420, Keelung rd., Sec. 1,Taipei, Taiwan, R.O.C.",2691-5193,cherry@asehome.com,http://www.asehcc.com.tw,上市,委託營造廠商興建國民住宅及商業大樓出租出售業務買賣各種建材及進出口業務室內設計裝潢工程(營造業除外),1995/03/06
408,109/10/25,2528,皇普,－ ,建材營造,桃園市桃園區文中路747號6樓,81271967,蘇永平,蘇永平,許連晉,財務部經理,唐如鈺,03-2171111,19850117,19950310,新台幣                 10.0000元,2770854090,95000000,0,2,福邦證券股份有限公司,(02)2371-1658,台北市中正區忠孝西路一段6號6樓,立本台灣聯合會計師事務所,王慕凡,鄧欣珊,CROWELL,"6F., No.747, Wenzhong Rd., Taoyuan Dist.Taoyuan City 330, Taiwan (R.O.C.)",03-2172222,spokesman@crowell.com.tw,http://crowell.com.tw,上市,委託營造廠商興建商業大樓及國民住宅出租、出售業務投資興闢都市計劃範圍內之停車場餐廳、咖啡廳、旅館業務之經營,1995/03/10
409,109/10/25,2530,華建,－ ,建材營造,台北市內湖區成功路五段460號16樓,11059409,鄭斯聰,吳裕國,李俊賢,營業及工程管理部副總,簡玲菁,022632-8877,19601228,19951012,新台幣                 10.0000元,2707524660,0,0,1,中國信託商業銀行代理部,02-66365566,台北市重慶南路一段八三號五樓,信永中和聯合會計師事務所,陳光慧,姚毓琳,DELPHA,"16FL.,NO.460,SEC.5,Chenggund RD,Neihu chiu.Taipei,Taiwan,R.O.C.",022633-8755,service@delpha.com.tw,www.delpha.com.tw,上市,委託營造廠商興建商業大樓出租出售業務委託營造廠商興建國民住宅出租出售業務房屋租售之介紹業務,1995/10/12
410,109/10/25,2534,宏盛,－ ,建材營造,台北市民生東路三段156號19樓之5,22221180,林新欽,陸永富,陳育德,經理,李禾汎,2719-9999,19860709,19960212,新台幣                 10.0000元,5927849620,0,0,1,群益金鼎證券(股)公司股務代理部,27023999,台北市大安區敦化南路二段97號B2,勤業眾信聯合會計師事務所,鄭旭然,陳麗琦,HSC,"19F.-5, No.156, Sec. 3, Minsheng E. Rd.,TAIPEI, TAIWAN, R.O.C",2546-4577,hsc@hsc.com.tw,http://www.hsc.com.tw,上市,委託營造廠興建國民住宅及商業大樓出售出租業務房屋租售之介紹業務室內裝潢之設計及施工業務(現場僅作辦公室使用),1996/02/12
411,109/10/25,2535,達欣工,－ ,建材營造,台北市大安區敦化南路二段92號9樓,18997007,王人正,執行長：廖肇邦,陳士修,副總經理,許維貞,(02)27062929,19670213,19960311,新台幣                 10.0000元,3211855950,0,0,1,日盛證券股份有限公司,(02)2541-9977,台北市中山區南京東路二段85號7樓,勤業眾信聯合會計師事務所,趙永祥,張清福,DA-CIN,"9TH FL,NO92,SECTION 2,TUN-HWA SOUTH ROADTAIPEI,TAIWAN",(02)27081317,cm10023@dacin.com.tw,www.dacin.com.tw,上市,集合住宅商辦大樓等建築工程總承包晶圓廠、封測廠等高科技廠房工程總承包捷運、道路等交通工程統包及總承包,1996/03/11
412,109/10/25,2536,宏普,－ ,建材營造,台北市大安區敦化南路二段71號21樓,23113054,段津華,段津華,詹俊炫,稽核經理,劉寶姝,(02)2755-2662,19881005,19960314,新台幣                 10.0000元,3328086520,0,0,1,元大證券股份有限公司,(02)2586-5859,台北市承德路三段210號 B1,安侯建業聯合會計師事務所,莊鈞維,王清松,Hong Pu,"21F., No. 71, Ses. 2, Dunhua S. Rd., Da'an Dist.,Taipei City 106, Taiwan ( R.O.C.)",(02)2708-2581,floyd@hong-pu.com.tw,www.hong-pu.com.tw,上市,營建,1996/03/14
413,109/10/25,2537,聯上發,－ ,建材營造,台北市信義區忠孝東路五段68號36樓,22659295,蘇永義,李志明,李志明,總經理,曾金卿,27229898,19870819,19960906,新台幣                 10.0000元,3005577950,0,0,2,元大證券股份有限公司股務代理部,25865859,台北市承德路三段210號地下一樓,安侯建業聯合會計師事務所,陳宗哲,池世欽,WE & WIN,"36F., NO.68, SEC. 5 Jhongsiao E. Rd., Sinyi DistrictTaipei,Taiwan, R.O.C.",27220300,3623@5v.com.tw,www.5v.com.tw,上市,委託營造廠商興建國民住宅及商業辦公大樓出租出售業務。代理及買賣各種工程材料建設機械及進出口業務。電腦設備安裝業。,1996/09/06
414,109/10/25,2538,基泰,－ ,建材營造,台北市中正區衡陽路五十一號十樓,12251662,陳世銘,馮先勉,林家正,會計部經理,程慈,23830666,19791107,19961101,新台幣                 10.0000元,4384487640,0,0,1,中國信託代理部,(02)6636-5566,台北市重慶南路一段八十三號五樓,安永聯合會計師事務所,黃建澤,楊智惠,KeeTai,"10F,NO.51,HERNGYANG ROAD,TAIPEI CITYTaipei R.O.C",23830222,kt104@thekeetai.com.tw,www.keetai.com.tw,上市,委託營造廠商興建商業大樓及國民住宅出售、出租業務(營造廠除外)企業管理、財務管理及投資計劃之諮詢分析顧問業務廢棄物處理業及其他環保服務業(廢棄土處理),1996/11/01
415,109/10/25,2539,櫻花建,－ ,建材營造,台中市西區臺灣大道二段239號4樓,22491640,陳正釭,陳世英,陳世英,總經理,沈淑貞,(04)36005800,19870502,19970716,新台幣                 10.0000元,5566798120,0,0,2,中國信託商業銀行代理部,(02)66365566,台北市重慶南路一段83號5樓,立本台灣聯合會計師事務所,張宜鈞,鄧欣珊,SAKURAD,"4F., No.239, Sec.2,Taiwan Blvd., West District,Taichung City 403, Taiwan (R.O.C.)",(04)36005799,saku.great@msa.hinet.net,www.sakurad.com.tw,上市,委託營造廠商興建國民住宅及商業大樓之出租出售業務,1997/07/16
416,109/10/25,2540,愛山林,－ ,建材營造,台北市大安區忠孝東路四段166號11樓之2,22190686,祝文宇,張境在,張境在,總經理,徐永仁,(02)8773-6688,19860906,19891226,新台幣                 10.0000元,1466000000,0,0,1,統一綜合證券(股)公司股務代理部,(02)2746-3797,台北市松山區東興路8號地下1樓,安侯建業聯合會計師事務所,張淑瑩,韓沂璉,JSL,"11F.-2, No.166, Sec. 4, Jhongsiao E. Rd., Taipei City 10688, Taiwan(R.O.C.)Taipei 106, Taiwan, R.O.C.",(02)8773-6689,amma@mail.jsl.com.tw,http://www.isanlin.com.tw/test/file.asp,上市,(所營事業第32條)H701010住宅及大樓開發租售業.(所營事業第35條)H703090不動產買賣業.(所營事業第36條)H703100不動產租賃業.,1989/12/26
417,109/10/25,2542,興富發,－ ,建材營造,台北市中山區樂群二路267號10樓,12305479,鄭志隆,范華軍,廖昭雄,開發部副總經理,王素月,(02)2755-5899,19800123,19990503,新台幣                 10.0000元,12832916270,0,0,1,群益金鼎證券(股)公司股務代理部,(02)2702-3999,106台北市大安區敦化南路二段97號地下二樓,安侯建業聯合會計師事務所,韓沂璉,簡蒂暖,Highwealth,"10F., No.267, Lequn 2nd RdTaipei 104,Taiwan,R.O.C",(02)2755-5988,karen@highwealth.com.tw,http://www.highwealth.com.tw/,上市,委託營造廠商興建商業大樓及國民住宅出租、出售業務。有關室內裝潢之設計及施工業務。有關建材、裝潢材料及建設機械之買賣及進出口業務等。,1999/05/03
418,109/10/25,2543,皇昌,－ ,建材營造,台北市中正區重慶南路3段180號,34342717,江程金,黃重雷,劉昭龍,副總經理,官心惠,2792-2988,19810216,19991015,新台幣                 10.0000元,2419837880,0,0,1,元富證券股份有限公司,(02)2768-6668,台北市105松山區光復北路11巷35號地下一樓,霈昇聯合會計師事務所,林憲章,吳瑞卿,HWANG CHANG,"No.180, Sec. 3, Chongcing S. Rd.,Taipei,Taiwan,R.O.C",2792-8399,pr@hcgc.com.tw,www.hcgc.com.tw,上市,土木建築工程之承攬業務,1999/10/15
419,109/10/25,2545,皇翔,－ ,建材營造,台北市博愛路38號8樓,86379024,廖年吉,廖宇祥,游玉華,財務部副總,王繼華,23882898,19911206,20000911,新台幣                 10.0000元,3277348080,0,0,1,元大證券股份有限公司,25865859,台北市承德路3段210號B1、B2,安侯建業聯合會計師事務所,曾國禓,簡蒂暖,HUANG HSIANG,"8FL,NO.38,BO AI  ROAD,TAIPEI,R.O.C",23896999,contact@hhe.com.tw,www.hhe.com.tw,上市,委託營造廠商興建住宅、商業大樓出租出售業務有關建材之買賣及進出口業務,2000/09/11
420,109/10/25,2546,根基,－ ,建材營造,106台北市和平東路三段131號6樓,43876760,袁藹維,黃慧仁,黃慧仁,總經理,范錦華,(02)2378-6789,19820413,20000911,新台幣                 10.0000元,1060356600,0,0,1,中國信託商業銀行代理部,(02)6636-5566,100台北市重慶南路一段83號5樓,安侯建業聯合會計師事務所,韓沂璉,簡蒂暖,KEDGE,"6F,#131 3SEC. HOPING E.RD.TAIPEI,TAIWAN,R.O.C.",(02)2739-6710,grace_fan@kindom.com.tw,http://www.kedge.com.tw,上市,土木、建築、水利及整地工程之承攬。各項基礎工程之承攬。橋樑、隧道工程之承攬。,2000/09/11
421,109/10/25,2547,日勝生,－ ,建材營造,台北市大同區市民大道一段209號14樓,12373243,林榮顯,沈景鵬,陳婷婷,協理,林士豪,(02)7733-8888,19820326,20001222,新台幣                 10.0000元,9000946490,0,0,1,凱基證券股份有限公司,(02)2389-2999,台北市重慶南路一段2號5樓,勤業眾信聯合會計師事務所,龔則立,劉水恩,RADIUM,"14FL., No.209, Sec. 1, Civic Blvd., Datong Dist.,Taipei, Taiwan, R.O.C.",(02)2559-5188,line@radium.com.tw,http://www.radium.com.tw,上市,委託營造廠商興建國民住宅商業大樓出租出售業務,2000/12/22
422,109/10/25,2548,華固,－ ,建材營造,台北市信義路四段456號7樓,23358846,鍾榮昌,洪嘉昇,劉若梅,財務長,姚秀琴.楊康平,2758-2828,19890406,20020826,新台幣                 10.0000元,2768127260,0,0,1,台新國際商業銀行股務代理部,2504-8125,台北市建國北路一段96號B1,資誠聯合會計師事務所,王方瑜,林瑟凱,HUAKU　　,"7F, No.456, Sec.4, Xinyi Rd.,　　Taipei , Taiwan , R.O.C.　",2729-2687,susan@huaku.com.tw,www.huaku.com.tw,上市,委託營造廠商興建商業大樓、國民住宅及廠辦之出租及出售室內裝潢業務及建材.機械買賣及進出口貿易業務委託營造廠興建一般工業用地之廠房倉庫出租等業務,2002/08/26
423,109/10/25,2597,潤弘,－ ,建材營造,台北市中山區八德路二段308號10樓,66394146,賴士勳,莫惟瀚,莫惟瀚,總經理,賴士勳,02-81619999,19751103,20100326,新台幣                 10.0000元,1350000000,0,0,1,本公司股務,81617999,台北市中山區八德路二段308號12樓,資誠聯合會計師事務所,王照明,徐明釧,REC,"10FL., No.308, Sec. 2, Bade Rd., Jhongshan District, Taipei City 104, TaiwanRepublic of China",02-81619988,cmc@mail.ruentex.com.tw,www.rtc.com.tw/index.aspx,上市,土木泥作建築工程、機電系統工程、預鑄牆板及柱筋工程之設計施工預拌泥作沙漿建材之開發、生產、銷售建築材料施作及買賣,2010/03/26
424,109/10/25,2601,益航,－ ,貿易百貨,台北市復興南路二段237號14樓,3353007,郭人豪,郭人豪,黎世明,財務長,林燕玲,27069911,19631008,19651104,新台幣                 10.0000元,6308831500,0,0,1,凱基證券股份有限公司,(02)2389-2999,台北市中正區重慶南路一段2號5樓,安侯建業聯合會計師事務所,張淑瑩,賴麗真,FSC,"14th Fl., No.237, Fuhsing S. Rd.,Sec. 2Taipei, Taiwan, R.O.C",27069922,firsteam@firsteam.com.tw,www.firsteam.com.tw,上市,百貨零售業經營國內外航運及有關之附屬業務、船舶及其零件批發業設備及小客車租賃業、經營國內外投資業務住宅及大樓開發租售業務,1965/11/04
425,109/10/25,2603,長榮,－ ,航運業,台北市中山區民生東路二段166號,11337775,張衍義,謝惠全,謝惠全,總經理,吳光輝,(02)2505-7766,19680925,19870921,新台幣                 10.0000元,48129737860,0,0,1,股務部,(02)2500-1668,台北市中山區民生東路二段166號2樓,資誠聯合會計師事務所,李秀玲,支秉鈞,EMC,"NO.166 , SEC.2 , MINSHENG EAST ROADTAIPEI , TAIWAN , R.O.C",(03)351-0973,public@evergreen-marine.com,www.evergreen-marine.com,上市,G301011船舶運送業、G401011船務代理業G404011貨櫃集散站經營業ZZ99999除許可業務外，得經營法令非禁止或限制之業務,1987/09/21
426,109/10/25,2605,新興,－ ,航運業,台北市大安區復興南路一段368號14樓,11812103,許積皋,許積皋,李義仁,副總經理,陳蘭芳,02-27037055,19680227,19891208,新台幣                 10.0000元,5853532970,0,0,1,中國信託商業銀行代理部,02-66365566,台北市重慶南路一段83號5樓,資誠聯合會計師事務所,翁世榮,林一帆,SNC,"14F, No.368 , FU HSING SOUTH ROAD,SECTION 1.TAIPEI, TAIWAN, R.O.C.",02-27003374,snctpe@snc.com.tw,http://www.snc.com.tw/,上市,船舶運送業拖船駁船業船務代理業,1989/12/08
427,109/10/25,2606,裕民,－ ,航運業,台北市敦化南路二段207號29樓,47067419,徐旭東,王書吉,張宗良,副總經理,陳長生,(02)27338000,19680829,19901208,新台幣                 10.0000元,8450557120,0,0,1,亞東證券股份有限公司,(0277531699,新北市板橋區新站路16號13樓,勤業眾信聯合會計師事務所,李振銘,王儀雯,U-MING,"29TH FL.,TAIPEI METRO TOWER,207,SEC.2,TUN HWA S.RD.TAIPEI 106,TAIWAN,REPUBLIC OF CHINA",(02)27359900,uming@metro.feg.com.tw,http://www.uming.com.tw,上市,船舶運送船舶買賣船務代理,1990/12/08
428,109/10/25,2607,榮運,－ ,航運業,桃園市桃園區經國路899號,4406559,陳義忠,林晁榮,林晁榮,總經理,陳成邦,03-3252060,19731005,19901214,新台幣                 10.0000元,10671410940,0,0,1,長榮國際儲運股份有限公司股務部,02-25001668,台北市中山區民生東路二段166號2樓,資誠聯合會計師事務所,李秀玲,支秉鈞,EITC,"899, CHING KUO ROAD,TAOYUAN DIST., TAOYUAN CITY, TAIWAN",03-3462009,mgt@evergreen-eitc.com.tw,www.evergreen-eitc.com.tw,上市,船舶運送及出租業汽車貨櫃貨運業貨櫃集散站經營業,1990/12/14
429,109/10/25,2608,嘉里大榮,－ ,航運業,台北市中正區新生南路一段50號14樓,51015548,沈宗桂,營運總處：張國典; 財務暨行政總處：阮慧雯,阮慧雯,財務暨行政總處總經理,胡明昌,02-33226888,19591221,19901220,新台幣                 10.0000元,4670004980,0,0,1,永豐金證券股份有限公司,02-23816288,台北市博愛路17號3樓,勤業眾信聯合會計師事務所,曾棟鋆,徐文亞,Kerry TJ,"14F., No.50, Sec. 1, Xinsheng S. Road,TAI-PEI,TAIWAN,R.O.C",02-33226777,investor@kerrytj.com,http://www.kerrytj.com,上市,汽車貨運業、汽車路線貨運業、汽車貨櫃貨運業倉儲業務、快遞業務、宅配業務冷凍車、冷凍櫃、冷凍庫出租業務及商品分類配送處理業務,1990/12/20
430,109/10/25,2609,陽明,－ ,航運業,基隆市七堵區明德一路271號,4200199,鄭貞茂,待董事會決議,史美琦,副總經理,何秀綺,02-2455-9988,19721229,19920420,新台幣                 10.0000元,26013357280,697394379,0,1,凱基證券股份有限公司,02-2389-2999,台北市中正區重慶南路一段2號5樓,勤業眾信聯合會計師事務所,鄭欽宗,洪玉美,YMTC,"271 Ming De 1st Road, ChiduKeelung Taiwan 206, R.O.C.",02-2455-9988,cs@yangming.com,http://www.yangming.com/,上市,國內外水上貨運、客運業務之經營倉庫、碼頭、拖船、駁船、貨櫃集散場站業務之經營船舶、貨櫃及車架之修理、租賃、買賣業務之經營,1992/04/20
431,109/10/25,2610,華航,－ ,航運業,桃園市大園區航站南路一號,11145904,謝世謙,謝世謙,陳奕傑,副總經理,林恒杉,(03)399-8888,19590907,19930226,新台幣                 10.0000元,54209846500,0,0,1,中國信託商業銀行代理部,(02)6636-5566,台北市中正區重慶南路一段83號5樓,勤業眾信聯合會計師事務所,黃瑞展,鄭旭然,CAL,"No.1, Hangqin S. Rd.,Dayuan Dist., Taoyuan City, Taiwan R.O.C",(03)399-8313,tpeprci@china-airlines.com,http://www.china-airlines.com,上市,客運、貨運、郵運代理業務(包括營業、運務)及代理修護倉儲業務之經營,1993/02/26
432,109/10/25,2611,志信,－ ,航運業,台北市中山區建國北路二段33號12樓,33853232,黃春發,王勝雄,江文隆,財務長,林燕文,(02)2509-0036,19731115,19931028,新台幣                 10.0000元,1729942470,0,0,1,統一綜合證券股份有限公司,(02)2746-3797,台北市松山區東興路８號Ｂ１樓,勤業眾信聯合會計師事務所,陳致源,黃堯麟,TSI,"12F., No.33, Sec. 2, Jianguo N. Rd., Zhongshan Dist.,Taipei City 104, Taiwan (R.O.C.)",(02)2500-7894,tstcomp@tsgroup.com.tw,www.tsgroup.com.tw,上市,運輸、航空營建、觀光休閒貿易商品買賣業務,1993/10/28
433,109/10/25,2612,中航,－ ,航運業,台北市濟南路一段15號9樓,43778070,彭士孝,戴聖堅,唐邦正,協理,孫賢中,(02)23963282,19780131,19941020,新台幣                 10.0000元,1974845930,0,0,1,凱基證券股份有限公司,(02)23148800,台北市重慶南路一段二號五樓,安侯建業聯合會計師事務所,區耀軍,羅瑞蘭,CMT,"9TH., 15, CHI-NAN ROAD, SEC. 1TAIPEI TAIWAN",(02)23513082,cmt@agcmt.com.tw,http://www.cmt.tw,上市,散裝貨輪運輸業(百分之百轉投資海外子公司)汽車貨櫃貨運業民用航空總代理,1994/10/20
434,109/10/25,2613,中櫃,－ ,航運業,新北市汐止區大同路三段二七五號,39014517,林宏年,吳清泉,蔡德新,副總經理,陳政宏,(02)86482211,19691127,19950120,新台幣                 10.0000元,1484234580,0,0,1,中國信託商業銀行代理部,(02)66365566,台北市重慶南路一段83號5樓,資誠聯合會計師事務所,阮呂曼玉,徐永堅,CCTC,"275,tatung road,sec.3,hsichihTaipei Hsien,Taiwan,Republic of China",(02)26491298,cctc@gcn.net.tw,http://www.cctcorp.com.tw,上市,經營港埠碼頭貨櫃集散站辦理貨櫃修理維護業務辦理一般倉庫及保稅業務,1995/01/20
435,109/10/25,2614,東森,－ ,貿易百貨,台北市復興南路一段368號8樓,4964250,廖尚文,廖尚文,鄭應娜,副總經理,呂正果,2755-7565,19750514,19950923,新台幣                 10.0000元,5567898890,0,0,1,統一綜合證券(股)公司股務代理部,2746-3797,台北市松山區東興路8號地下一樓,安侯建業聯合會計師事務所,池世欽,陳宗哲,EMIC,"8F,NO.368 FU HSING S. RD., SEC.1TAIPEI, TAIWAN 106",2702-8079,emic@emic.com.tw,http://www.emic.com.tw,上市,穀倉及散裝航運營運網路媒體事業多通路B2C零售事業,1995/09/23
436,109/10/25,2615,萬海,－ ,航運業,台北市松江路136號10樓,11395000,久福花園股份有限公司,謝福隆,蘇麗梅,代協理,謝福隆,02-25677961,19650224,19960516,新台幣                 10.0000元,22182974660,0,0,1,華南永昌綜合證券(股)公司股務部,02-27186425,台北市民生東路四段54號4樓,安侯建業聯合會計師事務所,郭柔蘭,江忠儀,WANHAI,"10TH FL,136 SUNG CHIANG RD.TAIPEI,TAIWAN, R.O.C",02-25216000,laura_su@wanhai.com,www.wanhai.com.tw,上市,船舶運送業船務代理、船舶及貨櫃買賣港口貨櫃集散站經營業務、船舶及貨櫃出租業務,1996/05/16
437,109/10/25,2616,山隆,－ ,油電燃氣業,新北市板橋區民生路一段1-2號1樓,33983853,鄭人豪,俞蘭輝,俞蘭輝,總經理,楊佳峰,(02)29599611,19760406,19971108,新台幣                 10.0000元,1372818270,0,0,1,山隆通運股份有限公司,(02)22225131,新北市板橋區民生路一段3號3樓,安侯建業聯合會計師事務所,羅瑞蘭,區耀軍,SLC,"1th FLOOR NO.1-2,DWC.1 MN-SHENG RD.PANCHIAO CITY,TAIPEI COUNTY,TAIWAN,R.O.C",(02)29599441,mlchuang@slc.com.tw,www.slc.com.tw,上市,汽車貨櫃貨運業汽車修理業及其零件買賣加油站業務及倉儲業務,1997/11/08
438,109/10/25,2617,台航,－ ,航運業,台北市濟南路二段29號2~6樓,3564713,劉文慶,仇忠林,仇忠林,總經理,王惠如,02-23941769,19460701,19980624,新台幣                 10.0000元,4172944870,0,0,1,台新國際商業銀行股務代理部,02-25048125,台北市建國北路一段96號地下一樓,勤業眾信聯合會計師事務所,黃惠敏,葉淑娟,TAIWANLINE,"2-6FL,NO.29, SEC.2,CHI NAN ROADTAIPEI, TAIWAN,R.O.C.",02-23970640,tnctpe@taiwanline.com.tw,http://www.taiwanline.com.tw,上市,海運服務業委託營造廠商興建住宅及商業大樓出租出售業務,1998/06/24
439,109/10/25,2618,長榮航,－ ,航運業,桃園市蘆竹區新南路一段376號,23225229,林寶水,孫嘉明,陳耀銘,公共關係室副總經理,林司忠,03-3515151,19890407,20010917,新台幣                 10.0000元,48535694900,0,0,1,長榮航空股務部,02-2500-1668,台北市民生東路二段166號2樓,安侯建業聯合會計師事務所,唐嘉鍵,蘇彥達,EVAAIR,"NO.376,SEC.1,HSIN-NAN ROADLUCHU DIST.,TAOYUAN CITY,TAIWAN",02-85003999,prd@evaair.com,www.evaair.com,上市,國際航線之定期及不定期航空客貨運輸業務,2001/09/17
440,109/10/25,2630,亞航,－ ,航運業,台南市仁德區仁愛里機場路1050號,11381701,盧天麟,盧天麟,趙晉賢,副總經理,黃俊憲,06-2681911,19550119,20180222,新台幣                 10.0000元,1201200000,0,0,1,台新國際商業銀行股務代理部,02-25048125,104台北市中山區建國北路一段96號B1,安侯建業聯合會計師事務所,蘇彥達,陳惠媛,AACL　　,"No.1050, JiChang Rd., Rende Dist.Tainan City 717, Taiwan, ROC",06-2691792,IR@airasia.com.tw,http://www.airasia.com.tw,上市,航空器與有關裝備之維修、租賃與買賣航空配件裝備之製造與裝配、精密工業設備之修理以及上述各項業務之代理與顧問,2018/02/22
441,109/10/25,2633,台灣高鐵,－ ,航運業,(11568)台北市南港區經貿二路66號13樓,16446274,江耀宗,鄭光遠,孫鴻文,營業資深副總經理,鄒衡蕪協理,02-8789-2000,19980511,20161027,新台幣                 10.0000元,56282930580,3000000000,0,2,富邦綜合證券股務代理部,02-2361-1300,台北市中正區許昌街17號2樓,勤業眾信聯合會計師事務所,江美艷,賴冠仲,THSRC,"13F., No.66, Jingmao 2nd Rd ., Nangang DistrictTaipei City 11568, Taiwan, R.O.C.　",02-8789-3000,Spokesman_MBOX@thsrc.com.tw,www.thsrc.com.tw,上市,高速鐵路之經營,2016/10/27
442,109/10/25,2634,漢翔,－ ,航運業,台中市西屯區漢翔路1號,97160544,胡開宏,馬萬鈞,馬萬鈞,總經理,莊秀美,04-27020001,19960701,20140825,新台幣                 10.0000元,9418671010,0,0,1,富邦綜合證券股份有限公司,02-23611300,台北市中正區許昌街17號2樓,勤業眾信聯合會計師事務所,吳麗冬,曾棟鋆,AIDC　　,"No.1, Hanxiang RoadTaichung, 40722 Taiwan, R.O.C.",04-22842295,IR@ms.aidc.com.tw,www.aidc.com.tw,上市,國內外軍用、民用航空及相關工業產品之發展、製造、裝修及銷售。協助國內航空工業建立中心衛星體系與制度。提供對航空工業系統之規劃、製造、整合、發展及管理之技術服務。,2014/08/25
443,109/10/25,2636,台驊投控,－ ,航運業,台北市信義區忠孝東路四段 563 號 12樓,22358734,顏益財,顏益財,許琳婕,經理,王春英,27532093,19870204,20161222,新台幣                 10.0000元,1171574020,0,0,1,群益金鼎證券股務代理部,02-2703-5000,臺北市大安區敦化南路二段97號B2,安侯建業聯合會計師事務所,于紀隆,吳美萍,T3EX,"12F. , No. 563 , Sec . 4, Zhongxiao E. Rd . ,Xinyi District ,Taipei City 11072 , Taiwan",27657197,spokesman@t3ex-group.com,www.t3ex-group.com,上市,一般投資業,2016/12/22
