,出表日期,stock_id,公司簡稱,外國企業註冊地國,產業別,住址,營利事業統一編號,董事長,總經理,發言人,發言人職稱,代理發言人,總機電話,成立日期_x,上市日期,普通股每股面額,實收資本額,私募股數,特別股,編制財務報表類型,股票過戶機構,過戶電話,過戶地址,簽證會計師事務所,簽證會計師1,簽證會計師2,英文簡稱,英文通訊地址,傳真機號碼,電子郵件信箱,網址,交易市場,主要經營業務,上市上櫃日期
0,109/10/25,1101,台泥,－ ,水泥工業,台北市中山北路2段113號,11913502,張安平,李鐘培,黃健強,資深副總經理,賴家柔,(02)2531-7099,19501229,19620209,新台幣                 10.0000元,59414007210,0,200000000,1,中國信託商業銀行代理部,66365566,台北市重慶南路一段83號5樓,勤業眾信聯合會計師事務所,邵志明,黃惠敏,TCC,"No.113, Sec.2, Zhongshan N. Rd.,Taipei City 104,Taiwan (R.O.C.)",(02)2531-6529,finance@taiwancement.com,http://www.taiwancement.com,上市,有關水泥及水泥製品之生產及運銷有關水泥原料及水泥製品原料之開採製造運銷及附屬礦石之開採經銷經營有關水泥工業及其附屬事業,1962/02/09
1,109/10/25,1102,亞泥,－ ,水泥工業,台北市大安區敦化南路2段207號30、31樓,3244509,徐旭東,李坤炎,周維崑,副總經理,吳玲綾,02-2733-8000,19570321,19620608,新台幣                 10.0000元,33614471980,0,0,1,亞東證券股份有限公司,02-7753-1699,新北市板橋區新站路16號13樓,勤業眾信聯合會計師事務所,戴信維,范有偉,ACC,"30-31F., No.207, Sec. 2, Dunhua S. Rd., Da' an Dist., Taipei City 106, TaiwanTAIPEI,TAIWAN,R.O.C",02-2378-5191,service@acc.com.tw,www.acc.com.tw,上市,"水泥,水泥之半成品,水泥製品,預拌混凝土及其添加劑之生產運銷水泥原料,水泥製品原料及砂石開採及爐石粉,石灰石粉之製造運銷其他未述及之項目請參照本公司營業執照之所營事業",1962/06/08
2,109/10/25,1103,嘉泥,－ ,水泥工業,台北市中山北路2段96號,11892801,張剛綸,祁士鉅,王立心,執行副總經理,余曉芸,(02)2551-5211,19541213,19691114,新台幣                 10.0000元,7747805480,0,0,1,群益金鼎證券股份有限公司股代部,(02)2702-3999,台北市敦化南路2段97號地下2樓,勤業眾信聯合會計師事務所,虞成全,張耿禧,CHC,"No.96, Sec. 2, Zhongshan N. Rd., Zhongshan Dist.Taipei City 10449, Taiwan (R.O.C.)",(02)2511-4002,ir@chcgroup.com.tw,www.chcgroup.com.tw,上市,水泥、生產、銷售,1969/11/14
3,109/10/25,1104,環泥,－ ,水泥工業,台北市南京東路二段125號10樓,7568009,侯博義,侯智升,楊宗仁,副總經理,詹志鴻,02-25077801,19600321,19710201,新台幣                 10.0000元,6536091920,0,0,1,華南永昌綜合證券(股)股務代理部,02-27186425,﹝105﹞台北市松山區民生東路四段54號4樓,勤業眾信聯合會計師事務所,楊朝欽,郭麗園,UCC,"10th F1., 125 Nanking E.Rd Sec. 2,Taipei Taiwan",02-25075870,ucc@ucctw.com,www.ucctw.com,上市,水泥原料熟料及水泥製品原料之開採製造生產運銷石膏板及其原料生產加工運銷，裝潢工程設計安裝前各項有關產品之進出口代理銷售業務,1971/02/01
4,109/10/25,1108,幸福,－ ,水泥工業,台北市松江路237號15樓,40601248,陳兩傳,陳兩傳,溫秀菊,財務部經理,陳一誠,25092188,19740507,19900606,新台幣                 10.0000元,4047380490,0,0,1,永豐金證券股務代理,2381-6288,台北市中正區博愛路17號3樓,勤業眾信聯合會計師事務所,黃海悅,陳招美,LUCKY CEMENT,"15TH FL.,NO.237,SUNG KIANG RD.,TAIPEI,TAIWAN,R.O.C.",25048672,"wendy@luckygrp,com.tw",www.luckygrp.com.tw,上市,有關水泥及水泥製品之工業及相關事業,1990/06/06
5,109/10/25,1109,信大,－ ,水泥工業,台北市寶慶路37號7樓,3279507,楊智雄,楊大寬,吳連富,副總經理,朱萍,(02)23816731,19640315,19911205,新台幣                 10.0000元,3419578680,0,0,1,中國信託商業銀行代理部,(02)6636-5566,台北巿重慶南路一段83號5樓,資誠聯合會計師事務所,賴宗羲,徐明釧,HsingTa,"7TH FL.,No.37 Pao Ching RoadTaipei Taiwan R.O.C.",23314086,service@hsingta.com.tw,www.hsingta.com.tw,上市,有關水泥及水泥製品之生產及運銷,1991/12/05
6,109/10/25,1110,東泥,－ ,水泥工業,高雄市前金區五福三路21號4樓之1,83078600,陳敏斷,吳長直,黃薪翰,財務部經理,唐榮宗,07-2711121,19561228,19941022,新台幣                 10.0000元,5720007970,0,0,1,元大證券股份有限公司,02-25865859,台北市承德路三段210號地下室1樓,國富浩華聯合會計師事務所,蔡淑滿,李青霖,TUNA CEMENT,"NO.21 Wu Fu 3 RoadKaohsiung, Taiwan, R.O.C.",07-9505895,southeast@secement.com,www.southeastcement.com.tw,上市,(1)水泥製造與買賣(2)石灰石之開採及銷售(3)水泥加工製品及預拌混凝土之製造及銷售(4)廠房及大樓出租業(5)廢棄物處理業,1994/10/22
7,109/10/25,1201,味全,－ ,食品工業,台北市松江路125號,11347802,陳宏裕,張教華,黃國禎,財務長,陳盟元,(02)25065020,19530922,19620209,新台幣                 10.0000元,5060629140,0,0,1,元大證券股務代理部,(02)25865859,台北市大同區承德路3段210號地下一樓,資誠聯合會計師事務所,吳郁隆,黃世鈞,WEI CHUAN,"10F., No.125, Sung Chiang Rd.Taipei, Taiwan, R.O.C.",(02)25063182,service@weichuan.com.tw,http://www.weichuan.com.tw,上市,食品製造及販賣,1962/02/09
8,109/10/25,1203,味王,－ ,食品工業,台北市中山北路二段79號5樓,7067309,陳清福,陳恭平,魏璟雄,經理,李兆弘,(02)25717271,19590704,19640824,新台幣                 10.0000元,2400000000,0,0,1,群益金鼎證券股份有限公司,27023999,台北市敦化南路二段97號地下2樓,大中國際聯合會計師事務所,林寬照,溫明郁,VE WONG,"5TH FL., 79 CHUNG SHAN N. RD., SEC.2TAIPEI TAIWAN",(02)25811006,wei@vewong.com.tw,http://www.vewong.com,上市,味精.醬油.罐頭.調理速食品.飲料等製造及營銷有關進出口業務洋菸酒類及飲料之進口及經銷汽車檢驗及修理,1964/08/24
9,109/10/25,1210,大成,－ ,食品工業,台南市永康區蔦松二街三號,73008303,韓家宇,莊坤炎,周叔恆,特助,夏銜譽,06-2531111,19601228,19780520,新台幣                 10.0000元,8273390860,0,0,1,中國信託商業銀行代理部,02-66365566,台北市重慶南路一段八十三號六樓,安侯建業會計師事務所,鍾丹丹,陳眉芳,GREATWALL,3 NIAOSUN 2TH STREETYONGKONG TAINAN CONTY TAIWAN,06-2534596,john@greatwall-group.com,http://www.dachan.com,上市,飼料大宗油脂肉品,1978/05/20
10,109/10/25,1213,大飲,－ ,食品工業,新北市三重區重陽路三段99號10樓,35012903,王鎮民,王鎮民(兼),王鎮民,董事長,洪松輝,(02)2982-0061,19650724,19810410,新台幣                 10.0000元,566226270,0,0,1,大西洋飲料股份有限公司,(02)2982-0061,新北市三重區重陽路三段99號10樓,南台聯合會計師事務所,丁澤祥,蔡玉琴,N,"10F,99,Sec.3,Chung Yang Road,San Chung City,Taipei Hsien,Taiwan,R.O.C.",(02)2984-1154,c5012903@ms23.hinet.net,http://applesidra.com.tw,上市,製造蘋果汽水礦泉水及各種汽水飲料等之批發經銷各國及國內有關飲料之產品副產品加工產品百貨批發,1981/04/10
11,109/10/25,1215,卜蜂,－ ,食品工業,台北市松江路八十七號十七樓,36514783,鄭武樾,許瑞通,劉明哲,特別助理,謝筱芬,02-25077071,19770822,19870727,新台幣                 10.0000元,2679909980,0,0,1,中國信託商業銀行代理部,02-66365566,台北市重慶南路一段八十三號五樓,資誠聯合會計師事務所,林一帆,翁世榮,CPE,"17F., 87 Sung Chiang Road,Taipei, Taiwan 104",02-25064137,service@cptwn.com.tw,http://www.cptwn.com.tw,上市,各種飼料生產加工配製銷售進口及買賣各種禽畜育種、電動屠宰業務及各種禽畜加工品製品銷售各種肉類加工品與調理食品及蛋品生產銷售等業務,1987/07/27
12,109/10/25,1216,統一,－ ,食品工業,71001台南市永康區中正路301號,73251209,羅智先,黃釗凱、李清田,陳國煇,財務長,涂忠正,(06)253-2121,19670825,19871228,新台幣                 10.0000元,56820154210,0,0,1,統一綜合證券(股)公司股務代理部,(02)2746-3797,10570台北市松山區東興路8號統一大樓地下室一樓,資誠聯合會計師事務所,林姿妤,林永智,UNI-PRESIDENT,"No.301, Zhongzheng Rd., Yongkang Dist.,Tainan City 71001, Taiwan (R.O.C.)",(06)253-2661,jlian@mail.pec.com.tw,https://www.uni-president.com.tw,上市,食品事業、便利商店事業、流通事業包裝容器事業、食糧事業、油品事業其他(製藥事業、休閒開發事業、物流事業等),1987/12/28
13,109/10/25,1217,愛之味,－ ,食品工業,嘉義縣民雄鄉工業二路11號,65534366,陳冠翰,陳志展,陳冠翰,董事長,陳志展 陳建華 蕭宏基,05-2211521-4,19710626,19891028,新台幣                 10.0000元,4945133360,0,0,1,群益金鼎證券股份有限公司,02-27023999,台北市大安區敦化南路二段97號地下二樓,國富浩華聯合會計師事務所,蔡淑滿,李青霖,AGV,"NO.11,Kung Yeh Second Rd.,Min Hsiong Industrial ZoneChiayi Hsien,Taiwan",05-2216287,YUEHCHU@mail.agv.com.tw,www.agv.com.tw,上市,食品,1989/10/28
14,109/10/25,1218,泰山,－ ,食品工業,彰化縣田中鎮興工路6號,59661701,詹逸宏,詹景超,劉韋辰,經理,彭碧珍,04-8742211,19501026,19891111,新台幣                 10.0000元,4999990380,0,0,1,元大證券股份有限公司,02-25865859,台北市承德路三段210號B1,安侯建業聯合會計師事務所,曾國禓,陳宗哲,TAISUN,"No.6, Xinggong Rd., Tianzhong Township.Changhua County 520, Taiwan (R.O.C.)",04-8758989,taisunir@taisun.com.tw,www.taisun.com.tw,上市,各種食用油脂之精製及批發零售.各種清涼飲料.冷凍調理食品各種禽畜魚類飼料之加工製造及買賣,1989/11/11
15,109/10/25,1219,福壽,－ ,食品工業,台中市沙鹿區沙田路45號,56192402,洪堯昆,洪碩嬪,王四全,特助,陳祺炆,04-26362111,19550207,19901201,新台幣                 10.0000元,3220138870,0,0,1,凱基證券股份有限公司,02-23892999,100台北市重慶南路一段2號5樓,群智聯合會計師事務所,呂松裕,陳芓&#20227;,FWUSOW,"45,Sha-Tyan,Sha-LuTaichung Taiwan R.O.C",04-26358452,fwusow@fwusow.com.tw,www.fwusow.com.tw,上市,配合飼料食用油脂有機肥料,1990/12/01
16,109/10/25,1220,台榮,－ ,食品工業,台北市中山區南京東路二段206號6樓,3543210,陳維恭,陳英凱,陳玉能,副總經理,黃棣楨,(02)2506-9521,19690313,19911120,新台幣                 10.0000元,1770779440,0,0,1,中國信託商業銀行代理部,(02)66365566,台北市重慶南路一段83號5樓,立本台灣聯合會計師事務所,陳玉芳,陳怡琳,TAIROUN,"6TH FL. NO. 206.  NANKING E. RD., SEC. 2Taipei,Taiwan,ROC",(02)2507-7020,glen6572@tairoun.com.tw,http://www.tairoun.com.tw/,上市,飼料製造販賣果糖製造販賣玉米澱粉製造販賣,1991/11/20
17,109/10/25,1225,福懋油,－ ,食品工業,台中市大肚區沙田路一段453號,22102298,晉昇投資有限公司,許逸群,郭中儀,資深經理,李建儀,25073121,19860418,19930927,新台幣                 10.0000元,2187030510,0,0,1,群益金鼎證券股份有限公司,02-27023999,台北市敦化南路二段97號地下二樓,勤業眾信聯合會計師事務所,廖婉怡,陳招美,FOPCO,"3RD FL,150 NANKING EAST RD, SEC.2 TAIPEI TAIWAN R.O.CTAIPEI TAIWAN R.O.C.",(02)25071312,cherry.lin@fopco.com.tw,WWW.FOPCO.COM.TW,上市,麵粉，飼料，黃豆油，黃豆粉，大麥片，玉米粉之製造與銷售。家畜，家禽之養殖及肉類之加工銷售。一般進口貿易業務(許可業務除外)。,1993/09/27
18,109/10/25,1227,佳格,－ ,食品工業,台北市仁愛路三段136號5樓,22102473,曹德風,曹博睿,曹德風,董事長,陳俊明,2709-2323,19860606,19940409,新台幣                 10.0000元,9150895910,0,0,1,中國信託商業銀行代理部,(02)6636-5566,台北市重慶南路一段83號5樓,勤業眾信聯合會計師事務所,龔則立,陳致源,S.F.C,"5th Floor, Lotus Building,No.136, Jen Ai Road, Sec. 3,Taipei,Taiwan,R.O.C.",2706-7955,spokesperson1@sfworldwide.com,http://www.sfworldwide.com/,上市,"嬰兒麥粉,麥片及相關產品之生產製造食用油及滋養飲料粉之分裝,加工,銷售業務一般進出口貿易及餐廳之經營",1994/04/09
19,109/10/25,1229,聯華,－ ,食品工業,臺北市大同區承德路一段44號6樓,11996904,苗豐強,林信宏,林信宏,總經理,尹楊俊,(02)2786-1188,19550720,19760719,新台幣                 10.0000元,12814982150,0,0,1,中國信託商業銀行代理部,(02)6636-5566,台北市重慶南路一段83號5樓,安侯建業聯合會計師事務所,江曉苓,楊柳鋒,LHIHC,"6F., No.44, Sec. 1, Chengde Rd., Datong DistrictTAIPEI,TAIWAN,R.O.C",(02)2786-3232,info@lhic.com.tw,https://www.lhicholdings.com/,上市,一般投資業,1976/07/19
20,109/10/25,1231,聯華食,－ ,食品工業,台北市迪化街一段148號,7569627,李開源,林家齊,林志遠,財務處協理,陳姵岑,(02)25534546,19700707,19951102,新台幣                 10.0000元,1833251650,0,0,1,永豐金證券股份有限公司,(02)23816288,台北市博愛路17號3樓,勤業眾信聯合會計師事務所,張清福,趙永祥,Lian Hwa Foods,"148 TI HWA STREET SEC.1,Taipei,Taiwan,R.O.C",(02)25533479,tomlin@lianhwa.com.tw,www.lianhwa.com.tw,上市,食品,1995/11/02
21,109/10/25,1232,大統益,－ ,食品工業,台南市官田區二鎮里工業西路32號,20927014,羅智先,陳昭良,陳昭良,總經理,胡育誌,06-698-4500,19820524,19960209,新台幣                 10.0000元,1599749150,0,0,1,統一綜合證券股份有限公司,02-2746-3797,台北市東興路8號地下一樓,資誠聯合會計師事務所,林姿妤,林永智,TTET,"32, Gongye West Road, Erzhen Village, Guantian District, Tainan City, TaiwanTAINAN CITY, TAIWAN",06-698-5530,finance@mail.ttet.com.tw,http://www.ttet.com.tw,上市,黃豆油、粉加工，製造及銷售,1996/02/09
22,109/10/25,1233,天仁,－ ,食品工業,台北市忠孝東路4段107號6樓,18559415,李國麟,林仁宗,陳中智,財務暨行政協理,王文嫻,02-27765580,19751211,19990120,新台幣                 10.0000元,905919480,0,0,1,元大證券股份有限公司,02-25865859,台北市承德路3段210號地下一樓,安永聯合會計師事務所,呂倩雯,劉慧媛,Ten Ren,"6F. NO.107,SEC 4, Chung Hsiao East Road,Taipei, Taiwan, ROC",02-27403035,chafortea@tenren.com.tw,http://www.tenren.com.tw/,上市,茶葉製造加工茶葉製品買賣茶相關製品,1999/01/20
23,109/10/25,1234,黑松,－ ,食品工業,台北市信義路四段296號3樓,20651901,張斌堂,張斌堂,杜居燦,財務處處長,蔡曜光,(02)2706-2191,19691213,19990312,新台幣                 10.0000元,4018710940,0,0,1,宏遠證券股份有限公司股務代理部,(02)7719-8899,台北市大安區信義路四段236號3樓,勤業眾信聯合會計師事務所,郭乃華,池瑞全,HEY-SONG,"3RD FL. NO. 296, SEC. 4, HSIN YI RD.TAIPEI, TAIWAN, R.O.C.",(02)2755-2119,heysong@heysong.com.tw,www.heysong.com.tw,上市,"碳酸飲料,酒類,果蔬汁,咖啡飲料,運動飲料等.",1999/03/12
24,109/10/25,1235,興泰,－ ,食品工業,高雄市仁武區高楠公路10號,85617982,吳星澄,吳星澄,葉文隆,法務處經理,蘇玲慧,07-3425301-5,19721115,20000911,新台幣                 10.0000元,989554360,0,0,1,國票綜合證券股份有限公司,02-25936666,10369台北市重慶北路3段199號4樓,國富浩華聯合會計師事務所,李青霖會計師,謝仁耀會計師,ST,10 KAO-NANG HIGHWAYJEN-WUH KAOHSIUNG TAIWAN R.O.C.,07-3425694,shintai1235@seed.net.tw,www.shintai-feed.com.tw,上市,飼料,2000/09/11
25,109/10/25,1236,宏亞,－ ,食品工業,新北市新店區寶興路45巷8弄3號5樓,34106066,張云綺,張云綺,余彩雲,財務經理,吳哲維,(02)29180786,19760614,20010917,新台幣                 10.0000元,1083425100,0,0,1,群益金鼎證券股份有限公司,(02)2702-3999,台北市大安區敦化南路2段97號地下2樓,安永聯合會計師事務所,黃建澤,張正道,Hunya,"3,Alley8,Lane45,Pao Hsin Rd;Hsin Tien,Taipei,Taiwan,R.O.C.",(02)29180706,hunya.com.tw,www.hunya.com.tw,上市,糖果、餅乾、巧克力之製造、加工及買賣。月餅、西點、麵包糕餅等食品之製造、加工及買賣。七七巧克力、禮坊名店。,2001/09/17
26,109/10/25,1256,鮮活果汁-KY,KY 開曼群島                                                    ,食品工業,"Genesis Close, PO Box 446, Cayman Islands, KY1-1106",37759808,黃國晃,王明智,吳明憲,董事,黃永霞,512-57515501,20100112,20160317,新台幣                 10.0000元,338421600,0,0,1,兆豐證券股份有限公司股務代理部,02-33930398,台北市忠孝東路二段95號1樓,勤業眾信聯合會計師事務所,謝明忠,呂宜真,Sunjuice,"P.O. BOX 10338,GRAND CAYMAN KY1-1003Grand Cayman KY1-1003,Cayman Islands",512-57515503,XH@sunjuice.com.cn,http://www.myfreshjuice.com,上市,果汁、果粒、果粉類等產品之生產與銷售,2016/03/17
27,109/10/25,1301,台塑,－ ,塑膠工業,高雄市仁武區水管路100號,75708007,林健男,林健男,林勝冠,資深副總經理,張嘉澤,(02)2712-2211,19541105,19640727,新台幣                 10.0000元,63657407810,0,0,1,本公司股務組,(02)2718-9898,台北市敦化北路201號後棟1樓,安侯建業聯合會計師事務所,寇惠植,于紀隆,FPC,"4F, 201, Tung Hwa North RoadTaipei, Taiwan, R.O.C.",(02)2717-8108,formosa@fpc.com.tw,http://www.fpc.com.tw,上市,聚氯乙烯(PVC)、氯乙烯、液(石咸)、聚丙烯、高密度聚乙烯聚乙烯醋酸乙烯酯、低密度聚乙烯、線性低密度聚乙烯、丙烯酸酯高吸水性樹脂、碳素纖維、丙烯睛、甲基丙烯酸甲酯及環氧氯丙烷等,1964/07/27
28,109/10/25,1303,南亞,－ ,塑膠工業,台北市敦化北路201號,75370905,吳嘉昭,鄒明仁,吳嘉昭,董事長,葉明忠,(02)27122211,19580822,19671105,新台幣                 10.0000元,79308215890,0,0,1,本公司股務組,(02)27189898,台北市敦化北路201號後棟一樓,安侯建業聯合會計師事務所,郭欣頤,于紀隆,NPC,"201, TUNG HWA NORTH ROADTAIPEI TAIWAN, REPUBLIC OF CHINA",(02)27178533,nanya@npc.com.tw,http://www.npc.com.tw,上市,各種塑膠加工品、塑膠原料、電子材料、聚酯纖維之製銷及染整加工 、配電盤,1967/11/05
29,109/10/25,1304,台聚,－ ,塑膠工業,台北市內湖區基湖路37號12樓,11917107,吳亦圭,王克舜,吳銘宗,業務處協理,甘霖,02-87516888,19650526,19720520,新台幣                 10.0000元,11887635000,0,0,1,本公司股務部,02-26503773,台北市內湖區內湖路一段120巷17號6樓,勤業眾信聯合會計師事務所,莊碧玉,郭政弘,USI,"12TH FLOOR, NO. 37 JI-HU ROAD, NEI-HU DISTRICTTAIPEI 114, TAIWAN, R.O.C.",02-26599524,mtwu@csl.usife.com.tw,www.usife.com.tw,上市,塑膠原料之製造、加工及銷售電子材料其他,1972/05/20
30,109/10/25,1305,華夏,－ ,塑膠工業,台北市內湖區基湖路37號12樓,11686106,吳亦圭,林漢福,胡吉宏,副總經理,劉傳源,(02)8751-6888,19640429,19730305,新台幣                 10.0000元,5533814230,0,0,1,本公司股務部,(02)2650-3773,台北市內湖區內湖路一段120巷17號6樓,勤業眾信聯合會計師事務所,黃秀椿,邱政俊,CGPC,"12th Floor , NO.37 , Ji-Hu Rd. Nei-Hu DistrictTaipei, Taiwan, R.O.C.",(02)2659-9553,cgpcstkqa@cgpc.com.tw,https://www.cgpc.com.tw,上市,從事生產與銷售塑膠布，塑膠皮，塑膠管，塑膠粒塑膠粉，鹼氯品及其它有關產品為主要業務,1973/03/05
31,109/10/25,1307,三芳,－ ,塑膠工業,高雄市三民區通化街120號,83387850,林孟經,林至逸,林信宏,副總經理,陳偉鉅,(07)3712111,19730616,19851123,新台幣                 10.0000元,3978181260,0,0,1,中國信託代理部,(02)6636-5566,台北市重慶南路一段83號5樓,勤業眾信會計師事務所,吳秋燕,江佳玲,SAN FANG,"402 FENGJEN RD.,JENWU SHIANG,KAOSHIUNG,TAIWAN",(07)3711940,service@sanfang.com.tw,http://www.sanfang.com.tw,上市,聚氨基甲酸加工品之製銷事項不織布起毛布加工品製銷染整事項聚氯乙烯加工之製銷事項塑膠加工品生產技術研究改良事項各種皮革加工之製銷事項有關事業之投資經營事項,1985/11/23
32,109/10/25,1308,亞聚,－ ,塑膠工業,高雄市林園區工業一路3號,20747385,吳亦圭,吳培基,黃克名,業務部經理,陳政順,(02)8751-6888,19770125,19860620,新台幣                 10.0000元,5821018820,0,0,1,亞洲聚合股份有限公司股務部,(02)2650-3773,台北市內湖區內湖路一段120巷17號6樓,勤業眾信聯合會計師事務所,黃秀椿,邱政俊,APC,"NO.3,INDUSTRIAL 1ST RD., LINYUAN DIST.,KAOHSIUNG, TAIWAN, 832 ROC",(02)2659-9553,kmhuang@tpe.usife.com.tw,HTTP://WWW.apc.com.tw,上市,低密度聚乙烯及乙烯醋酸乙烯酯共聚合樹脂之生產及銷售.高密度聚乙烯及線型低密度聚乙烯之銷售.分解性塑膠原料之製造及銷售.,1986/06/20
33,109/10/25,1309,台達化,－ ,塑膠工業,台北市內湖區基湖路37號12樓,11893409,吳亦圭,吳培基,顏太明,執行副總經理,林金才,(02)8751-6888,19600406,19860627,新台幣                 10.0000元,3442310380,0,0,1,台達化學工業股份有限公司股務部,(02)2650-3773,台北市內湖區內湖路一段120巷17號6樓,勤業眾信聯合會計師事務所,黃秀椿,邱政俊,TTC,"12th Floor, No.37, Ji-Hu Rd.,Taipei 114,Taiwan,R.O.C.",(02)2659-9504,tmyen@ttc.com.tw,http://www.ttc.com.tw,上市,"聚苯乙烯及加工品之製銷,丙烯(月青)、丁二烯、苯乙烯共聚體樹脂ABS之製銷,﹝丙烯(月青)、苯乙烯共聚合樹脂﹞SAN之製銷玻璃棉及其有關產品之製銷,塑膠原料及加工品之製銷",1986/06/27
34,109/10/25,1310,台苯,－ ,塑膠工業,台北市羅斯福路一段六號八樓之一,20844865,林文淵,陳柏元,仲崇國,副總經理,周子聖,02-23966007,19791116,19870806,新台幣                 10.0000元,5278697640,0,0,1,元大證券(股)公司股務代理部,02-2586-5859,台北市承德路三段210號地下一樓,安侯建業聯合會計師事務所,吳麟,尹元聖,T.S.M.C.,"8th-1 F1.,6,Roosevelt.Sec.1,Taiwan,Taiwan,R.O.C.",23960755,acc@mail.smct.com.tw,www.smct.com.tw,上市,苯乙烯單體對二乙苯甲苯 乙苯,1987/08/06
35,109/10/25,1312,國喬,－ ,塑膠工業,臺北市南京東路四段1號10樓,4212250,楊品正,曾嘉雄,陳景福,財務部協理,周振銘,(02)8770-4567,19730925,19881221,新台幣                 10.0000元,9266203280,0,20000000,1,凱基證券(股)公司代理部,(02)2389-2999,台北市重慶南路一段2號5 樓,國富浩華聯合會計師事務所,蕭英嘉,王戊昌,GPPC,"10FL,No.1 SEC.4 NAN-JING E. ROADTAIPEI, TAIWAN  R.O.C.",(02)2545-8755,gppc@gppc.com.tw,http://www.gppc.com.tw,上市,石油化工原料製造業合成樹脂及塑膠製造業國際貿易業(除許可業務外得經營法令非禁止或限制之業務),1988/12/21
36,109/10/25,1313,聯成,－ ,塑膠工業,台北市南港區南港路一段209號A棟9樓,4748660,苗豐強,柯衣紹,陳逸蓁,經理,王家君,(02)26517889,19760814,19890327,新台幣                 10.0000元,13323476070,0,0,1,中國信託商業銀行代理部,(02)6636-5566,台北市重慶南路一段83號5F,勤業眾信聯合會計師事務所,李振銘,林文欽,UPC,"9F., Building A, No. 209 NanGang Rd., Sec. 1, NanGang Dist., Taipei, 115,Taiwan, R.O.C",(02)26515818,ir@upc.com.tw,http://www.upc.com.tw,上市,有機酸及其衍生物塑膠增韌劑樹脂及塑膠原料,1989/03/27
37,109/10/25,1314,中石化,－ ,塑膠工業,高雄市大社區經建路1號,3084741,陳瑞隆,余建松,陳穎俊,副總經理,黃國材,07-3513521,19690708,19910712,新台幣                 10.0000元,32848501300,0,0,1,本公司股務室,02-89782589,台北市松山區東興路12號3樓,安侯建業會計師事務所,陳眉芳,鍾丹丹,CPDC,"No. 1 Chinchian Road, Dashe HsiangKaohsiung, Taiwan, R. O. C.",07-3513642,list1314@ms.tse.com.tw,www.cpdc.com.tw,上市,石油化學產品CPL AN 之製造及銷售,1991/07/12
38,109/10/25,1315,達新,－ ,塑膠工業,台中市西屯區工業區35路51號,51059101,吳子聰,黃俊嘉,賴耿民,財會主管,陳昕晟,04-23595511,19661024,19920509,新台幣                 10.0000元,1386000000,0,0,1,中國信託商業銀行代理部,02-66365566,台北市重慶南路一段83號5樓,國富浩華聯合會計師事務所,張福郎,邱桂鈴,TAH HSIN,"NO.51, 35TH RD.,TAICHUNG INDUSTRIAL PARK ,TAICHUNG ,TAIWAN, R.O.C",04-23595557,thst@mail.tahhsin.com.tw,www.tahhsin.com.tw,上市,塑膠雨衣、什加工、PP瓦楞板等製品成衣、塗布加工製品傢俱、文具、護貝、皮件等製品,1992/05/09
39,109/10/25,1316,上曜,－ ,建材營造,台南市安平區永華路二段248號20樓之6,73654033,張祐銘,張祐銘,郭育政,財務部協理,朱麗娟,(06)2988318,19791211,19921015,新台幣                 10.0000元,1846776260,0,0,1,元大證券股份有限公司,(02)2586-5859,台北市大同區承德路三段210號地下一樓,安侯建業聯合會計師事務所,許振隆,陳惠媛,SUN  YAD,"20F.-6, No.248, Sec. 2, Yonghua RdAnping Dist., Tainan City 708, Taiwan",(06)2988311,fina@sunyad.com.tw,www.sunyad.com.tw,上市,住宅及大樓開發租售業務。合成皮有關材料之買賣及進出口貿易業務。保護玻璃有關材料之買賣及進出口貿易業務。,1992/10/15
