1295,109/10/25,4804,大略-KY,KY 開曼群島                                                    ,觀光事業,台北市松山區復興北路99號15樓212室,41244424,梁競偉,梁競偉,林亨杰,稽核主管,莊子彬,02-27157586,20110805,20151204,新台幣                 10.0000元,432479200,8663000,0,1,富邦綜合證券(股)公司股務代理部,(02)23611300,台北市中正區許昌街17號2樓,德昌聯合會計師事務所,林兆民,陳文彬,Da Lue,"Rm. 212, 15F., No. 99, Fuxing N. Rd., Songshan Dist., Taipei City 105Taiwan (R.O.C.)",02-27157586,henry.lin@victoriash.com,www.dalue.com.tw,上櫃,一站式婚宴會所婚紗攝影,2015/12/04
1296,109/10/25,4806,昇華,－ ,文化創意業,台北市內湖區行愛路176號4樓,70557661,俞惟中,蔡彥欣,蔡彥欣,總經理,利爾祥,02-2795-5112,20000509,20160309,新台幣                 10.0000元,419741850,10150000,0,1,元大證券股份有限公司,02-2586-5859,103台北市大同區承德路三段210號B1.B2,卓群聯合會計師事務所,曾友龍,葉璨增,Shec,"4F., No.176, Sing'ai Rd., Neihu Dist.,Taipei City Taiwan(R.O.C)",02-2795-5113,henry.chai@shec.com.tw,http://www.shec.com.tw/,上櫃,電視劇製作電視劇編劇藝人經紀,2016/03/09
1297,109/10/25,4903,聯光通,－ ,通信網路業,新竹市科學園區研新四路12號,21223267,段竹平,段竹平,陳文魁,財務副總經理,陳奮賢,03-5779211,19840615,20010514,新台幣                 10.0000元,902793270,0,0,1,康和綜合證券股份有限公司,02-87871888,110台北市信義區基隆路一段176號B1,德昌聯合會計師事務所,李定益,陳裕勳,UFOC,"#12, Creation Road IV, Science-Based Industrial ParkHsinchu, Taiwan, R.O.C.",03-5779333,IR@ufoc.com.tw,www.ufoc.com.tw,上櫃,光纖電纜及配合材料數據產品傳輸設備光通信工程等,2001/05/14
1298,109/10/25,4905,台聯電,－ ,通信網路業,台北市內湖區瑞光路108號3樓,23882531,華盛國際投資股份有限公司,黃仲康,黃仲康,總經理,張北呂,02-26583000,19900803,20011207,新台幣                 10.0000元,326402650,0,0,1,中國信託商業銀行代理部,02-6636-5566,台北市重慶南路一段83號5樓,安永聯合會計師事務所,林素雯,劉慧媛,TAINET,"3F., No.108, Ruiguang Rd., Neihu Dist.,Taipei City 114, Taiwan",02-8792-2226,jack.huang@tainet.net,www.tainet.com.tw,上櫃,高階數據機XDSL用戶迴路接取設備光纖接取設備,2001/12/07
1299,109/10/25,4907,富宇,－ ,建材營造,台中市西屯區市政北二路238號16樓之3,22099391,張清全,鍾堯明,張世欣,副總經理,張育娟,(04)2258-5357,19880826,20020304,新台幣                 10.0000元,1181457780,0,0,2,元富證券股份有限公司股務代理處,(02)2768-6668,台北市松山區光復北路11巷35號地下一樓,立本台灣聯合會計師事務所,王慕凡,張宜鈞,Fu Yu  Property,"16F.-3, No.238, Shihjheng N. 2nd Rd., Situn Dist., Taichung City 40756, TaiwanTaichung City, Taiwan",(04)2258-5320,fuyuproperty@fuyu-property.com.tw,www.fuyu-property.com.tw,上櫃,委託營造廠商興建商業大樓及國民住宅出租、出售業務。有關建材、裝潢材料及建設機械之買賣及進出口業務等,2002/03/04
1300,109/10/25,4908,前鼎,－ ,通信網路業,新竹縣湖口鄉新竹工業區自強路三號,16634613,葉政彥,葉政彥,張啟文,副總經理,石世杰,(03)5986799,19980720,20020227,新台幣                 10.0000元,782169070,0,0,2,永豐金證券股份有限公司,(02)23816288,台北市博愛路十七號三樓,安侯建業聯合會計師事務所,陳玫燕,陳雅琳,APAC　　,"3 Tzu Chiang Road, Hsinchu Industrial Park, HukowHsin-Chu Hsien, Taiwan R.O.C.　　",(03)5973852,finance@apacoe.com.tw,www.apacoe.com.tw,上櫃,設計、研發、生產及銷售雷射二極體、受光二極體封裝及光傳接模組之相關光纖通訊產品,2002/02/27
1301,109/10/25,4909,新復興,－ ,通信網路業,桃園市新屋區望間里10鄰十五間45號,45163295,張永輝,張永輝,廖毅樺,財務部襄理,賴允照,03-4722191,19841130,20021128,新台幣                 10.0000元,933568640,0,0,1,中國信託商業銀行代理部,02-66365566,台北市重慶南路一段83號5樓,勤業眾信聯合會計師事務所,張清福,鄭欽宗,NEE,"NO.45,15th Jian,Wangjian VillageSinwu Township,Taoyuan County327 R.O.C",03-4723759,lily@nee.com.tw,www.nee.com.tw,上櫃,高頻微波通訊用基板一般資訊週邊用基板,2002/11/28
1302,109/10/25,4911,德英,－ ,生技醫療業,台南市安南區科技五路92號,80225425,郭國華,郭國華,周省輝,稽核主管,陳姝妙,06-3840890,20020806,20110321,新台幣                 10.0000元,556600000,0,0,2,華南永昌綜合證券股份有限公司,02-27186425,臺北市民生東路四段54號4樓,資誠聯合會計師事務所,林永智,田中玉,G&E,"No.92,Keji 5th Rd., Annan Dist., Tainan CityAnnan Dist., Tainan 70955, Taiwan",06-3840918,ge@geherbs.com.tw,www.geherbs.com.tw,上櫃,植物新藥、功能性化粧品、保健食品研發與製造,2011/03/21
1303,109/10/25,4924,欣厚-KY,KY 開曼群島                                                    ,電腦及週邊設備業,台北市中山區長安東路一段16號7樓之2,53025260,劉鳳君,顧小美,劉景成,總經理-HPI,林文凱,02-2567-7111,20091016,20111018,新台幣                 10.0000元,371644090,0,0,1,中國信託商業銀行代理部,02-6636-5566,台北市中正區重慶南路一段83號五樓,德昌聯合會計師事務所,陳裕勳,李定益,HTM,"Chang-An E. Rd. Sec.2 16#, 7th Floor-2Taipei City, Taiwan.",02-2567-7222,hsihou@hsihou.com,http://www.hsihou.com/,上櫃,電腦及週邊設備業其他電子業,2011/10/18
1304,109/10/25,4931,新盛力,－ ,電腦及週邊設備業,高雄市高雄加工出口區西十五街一號,70848850,張中秋,張中秋,范貴鈞,副總經理,陳柏閎,(07)8411501,20040726,20190917,新台幣                 10.0000元,619757610,0,0,1,台新國際商業銀行股份有限公司,(02)25048125,台北市中山區建國北路一段96號地下一樓,勤業眾信聯合會計師事務所,許瑞軒,郭麗園,STL,"No.1, West 15th Street,Kaohsiung Export Processing ZoneKaohsiung City 80681, Taiwan",(07)8414200,IR@stl-tech.com,www.stl-tech.com,上櫃,鋰電池模組製造銷售電池零件買賣電子材料買賣,2019/09/17
1305,109/10/25,4933,友輝,－ ,光電業,桃園市大溪區仁善里松樹21-9號,80660088,吳東昇,吳昕杰,楊堯如,會計主管,李燕蘭,03-3074830,20031231,20110729,新台幣                 10.0000元,782546750,0,0,1,新光證券股份有限公司,02-23118787,台北市重慶南路一段66之一號11樓,勤業眾信聯合會計師,陳文香,徐文亞,UBRIGHT,"No. 21-9, Song-Su, Jen-Shan Li, Ta-Chi Chen,Taoyuan Hsien, Taiwan, R.O.C.",03-3074769,yyr@ubright.com.tw,WWW.UBRIGHT.COM.TW,上櫃,LCD背光模組零組件-聚光片,2011/07/29
1306,109/10/25,4939,亞電,－ ,電子零組件業,新竹縣竹北市中華路676巷18號4樓,80494173,李建輝,李建輝,鄭宛鈺,財務部經理,王建朝,03-6569308,20030707,20110919,新台幣                 10.0000元,982008680,0,0,1,福邦證券股份有限公司,02-23711658,台北市中正區忠孝西路一段6號6樓,安永聯合會計師事務所,洪茂益,羅筱靖,AEM,"4F., No.18, Lane 676, Jhonghua Rd.,Jhubei City, Hsinchu County,Taiwan(R.O.C",03-6569270,monica.cheng@aemg.com.tw,http://www.aemg.com.tw/,上櫃,覆蓋膜軟性銅箔基層板補強板,2011/09/19
1307,109/10/25,4944,兆遠,－ ,光電業,新竹科學園區苗栗縣竹南鎮科北五路8號,12646223,姚宕梁,鄭松森,吳政穆,副執行長,張淑如,037-585058,20001102,20110531,新台幣                 10.0000元,870892960,21976480,0,1,宏遠證券股份有限公司,02-23268818,台北市信義路四段236號3樓,安侯建業聯合會計師事務所,黃泳華,陳振乾,CRYSTALWISE,"No.8,Kebei 5th Rd., Hsinchu Science Park, Zhunan Township,Miaoli County,35053,  Taiwan, R.O.C.",037-585177,crystalwise@crystalwise.com,http://www.crystalwise.com,上櫃,光電材料基板,2011/05/31
1308,109/10/25,4946,辣椒,－ ,文化創意業,台北市內湖區瑞光路583巷31號3樓,28222209,鄧潤澤,李亦華(執行長),蕭雅馨,行銷長,賴怡琳,02-8751-1699,20060921,20110610,新台幣                 10.0000元,136603980,0,0,1,統一綜合證券(股)公司股務代理部,02-2746-3797,台北市松山區東興路8號B1,勤業眾信聯合會計師事務所,邵志明,黃惠敏,Cayenne Tech,"3F, No31,Lane 583,Rueiguang Rd,Neihu District,Taipei 11492,Taiwan",02-8797-1717,ct@cayennetech.com.tw,http://www.wasabii.com.tw/,上櫃,資訊軟體服務業資料處理服務業、一般廣告服務業除許可業務外，得經營法令非禁止或限制之業務,2011/06/10
1309,109/10/25,4950,牧東,－ ,其他,台北市大安區敦化南路二段76號24樓,24302624,李明聰,李明聰(代),徐琦業,財務協理,林淑華,02-27006958,20081024,20120427,新台幣                 10.0000元,457790000,0,0,1,宏遠證券股份有限公司,02-27008899,台北市信義路四段236號3樓,勤業眾信聯合會計師事務所,陳培德,林文欽,Mutto,"24F., No.76, Sec. 2, Dunhua S. Rd., Da’an Dist.Taipei City 106, Taiwan (R.O.C.)",02-27060058,jean@muttoinc.com,http://www.muttoinc.com,上櫃,不鏽鋼製品之加工與銷售,2012/04/27
1310,109/10/25,4953,緯軟,－ ,資訊服務業,新北市汐止區新台五路1段93號32樓,86714857,蕭清志,蕭清志,長育禎,副總經理,李禎惠,02-77458888,19920601,20140108,新台幣                 10.0000元,667083230,0,0,1,凱基證券股份有限公司,02-23892999,台北市重慶南路一段2號5樓,安侯建業聯合會計師事務所,陳雅琳,黃明宏,WITS,"32F., No.93, Sec.1, Xintai 5th Rd., Xizhi Dist., New Taipei CityNew Taipei City , Taiwan (R.O.C.)",02-77458889,spokesperson@wistronits.com,www.wistronits.com,上櫃,軟體外包服務,2014/01/08
1311,109/10/25,4966,譜瑞-KY,KY 開曼群島                                                    ,半導體業,"P.O.Box 309GT,Ugland House,South Church Street,George Town",28422591,趙捷,曲明,趙捷,董事長兼執行長,張祐銘,02-2627-9109,20051115,20110913,新台幣                 10.0000元,807580920,0,0,1,中國信託商業銀行代理部,02-6636-5566,台北市100重慶南路一段83號5樓,資誠聯合會計師事務所,周筱姿,梁華玲,Parade,"9F., No.71, Zhouzi St., Neihu Dist.Nei Hu, Taipei, Taiwan, R.O.C.",02-2627-9339,ir@paradetech.com,http://www.paradetech.com,上櫃,高速訊號傳輸介面及顯示與觸控晶片之研發設計及銷售,2011/09/13
1312,109/10/25,4971,IET-KY,KY 開曼群島                                                    ,半導體業,"PO Box 309, Ugland House, Grand Cayman, KY1-1104, Cayman Isl",39954594,高永中,高永中,王家齊,財務長,王維寧,+1-9722340068,20110426,20130724,新台幣                 10.0000元,365181430,0,0,1,中國信託商業銀行代理部,(02)66365566,台北市重慶南路一段83號5樓,資誠聯合會計師事務所,梁嬋女,連忠政,IET,"PO Box 309, Ugland House, Grand Cayman, KY1-1104, Cayman IslandsCayman Islands",+1-9722340069,investors@intelliepi.com,www.intelliepi.com.tw,上櫃,GaAs pHEMT epi wafersInP HBT epi wafersGaSb infrared material and epi wafers,2013/07/24
1313,109/10/25,4972,湯石照明,－ ,光電業,新北市樹林區博愛街236號4樓,86831927,湯士權,洪家政,王志遠,財會部協理,詹益禎,02-86857855,19920820,20130617,新台幣                 10.0000元,396533030,0,0,1,宏遠證券股份有限公司,02-2326-8818,台北市大安區信義路四段236號3樓,資誠聯合會計師事務所,洪淑華,劉美蘭,TONS,"4F., No.236, Bo’ai St., Shulin Dist.,New Taipei City , Taiwan (R.O.C.)",02-86857655,investor@tons.com.tw,http://www.tonslight.com/,上櫃,專業商用照明燈具設計及製造,2013/06/17
1314,109/10/25,4973,廣穎,－ ,半導體業,台北市內湖區洲子街106號7樓,80161908,陳慧民,袁培榮,謝超民,副總經理,唐婉佩,02-8797-8833,20030218,20120619,新台幣                 10.0000元,635058330,0,0,1,群益金鼎證券股份有限公司,02-2702-3999,台北市敦化南路二段97號地下2樓,資誠聯合會計師事務所,周筱姿,賴宗羲,Silicon Power,"7F., No. 106, Zhouzi St.Neihu District, Taipei City 114, Taiwan",02-8751-6595,sp.ir@silicon-power.com,www.silicon-power.com,上櫃,快閃記憶體相關產品之製造及買賣記憶體模組之製造及買賣,2012/06/19
1315,109/10/25,4974,亞泰,－ ,電子零組件業,新北市中和區中正路880號2樓,80640083,賴以仁,賴以仁/吳淑品,吳淑品,行政總經理,陳信宏,(02)8228-6401,20040120,20111129,新台幣                 10.0000元,725001040,0,0,1,中國信託商業銀行 代理部,(02)6636-5566,台北市重慶南路1段83號5樓,勤業眾信聯合會計師事務所,吳麗冬,蔣淑菁,ATII,"2F., No.880, Zhongzheng Rd.,Zhonghe Dist., New Taipei City 235, Taiw",(02)8228-6400,IR@atii.com.tw,www.atii.com.tw,上櫃,影像感測器之買賣,2011/11/29
1316,109/10/25,4979,華星光,－ ,通信網路業,桃園市中壢區合江路6號,12927477,鄭敦謙,倪慎如,林小喬,財務長,王雅瑜,(03)452-5188,20011115,20111212,新台幣                 10.0000元,1201242790,18950000,0,1,中國信託商業銀行,02-6636-5566,100台北市中正區重慶南路一段八十三號五樓,安侯建業聯合會計師事務所,吳美萍,于紀隆,LuxNet,"No.6 ,Hejiang  RoadJhongli City, Tao-Yuan , Taiwan, R.O.C.",(03)462-9588,luxnet@luxnetcorp.com.tw,www.luxnetcorp.com.tw,上櫃,電子零組件製造業及電子材料批發業等相關產業,2011/12/12
1317,109/10/25,4987,科誠,－ ,電腦及週邊設備業,新北市中和區建康路168號13樓,84152965,戴奉義,姚啟正,陳美蘭,財務長,林明宗,02-2225-8580,19930104,20120321,新台幣                 10.0000元,252000000,0,0,1,福邦證券股份有限公司股務代理部,2383-6888,台北市中正區忠孝西路一段6號6樓,資誠聯合會計師事務所,黃世鈞,吳郁隆,GODEX,"13F, NO. 168, JIAN-KANG ROAD ZHONGHE  DISTRICTNEW TAIPEI CITY , TAIWAN",02-22258480,public@godexintl.com,www.godexintl.com,上櫃,"條碼標籤印製機之研發,製造及銷售。",2012/03/21
1318,109/10/25,4991,環宇-KY,KY 開曼群島                                                    ,半導體業,"190 Elgin Avenue, George Town, KY1-9005, Cayman Islands",38612141,黃大倫,安寶信( 總執行長暨總裁),余有崇,資深副總,李亞菁,02-87986922,20101130,20140915,新台幣                 10.0000元,914352540,0,0,1,中國信託商業銀行代理部,02-66365566,台北市重慶南路一段83 號5 樓,資誠聯合會計師事務所,鄭雅慧,林玉寬,GCS,"23155 Kashiwa CourtTorrance, California, USA",02-23610085,investors@gcsincorp.com,http://gcsincorp.com,上櫃,砷化鎵/磷化銦/氮化鎵及碳化矽高階射頻及光電元件化合物晶圓代工自有品牌光電元件產品之研究、開發、製造及銷售業務相關智慧財產權授權,2014/09/15
1319,109/10/25,4995,晶達,－ ,光電業,新北市新店區寶橋路235巷137號8樓,70783202,李英珍,金仲仁,蘇俊生,財務及會計主管,洪淑芬,(02)8919-1858,20000818,20120509,新台幣                 10.0000元,417840360,0,0,1,福邦證券股份有限公司股務代理部,(02)2371-1658,台北市忠孝西路一段6號6樓,勤業眾信聯合會計師事務所,林旺生,黃瑞展,Litemax,"8F., No.137, Ln. 235, Baoqiao Rd.,Xindian Dist.,New Taipei City 231,Taiwan",(02)8919-1300,ir@litemax.com.tw,www.litemax.com.tw,上櫃,高亮度液晶面板模組及顯示器特殊應用系統平台,2012/05/09
1320,109/10/25,5009,榮剛,－ ,鋼鐵工業,台南市新營區新中路35號(總部地址:台南市柳營區工二路10號),84252697,王炯棻,許澤東,許澤東,總經理,李郁真,06-6520031,19930319,19981017,新台幣                 10.0000元,4667359910,0,0,1,元大證券股份有限公司,02-25865859,台北市承德路三段210號B1,勤業眾信聯合會計師事務所,趙永祥,邱盟捷,GMTC　,"35, HSIN CHUNG ROAD, HSINYING CITYTAINAN HSIEN, TAIWAN 730　　　",06-6230890,www.gmtc.com.tw　,www.gmtc.com.tw,上櫃,特殊鋼(工具鋼、低合金鋼、軸承鋼、不銹鋼、高速鋼)碳鋼(含中、高拉鋼筋)特殊鍛件與模具(鍛胚、車軸、機械主軸、輥子、輥軸、壓輪等)之製造加工與銷售業務。,1998/10/17
1321,109/10/25,5011,久陽,－ ,鋼鐵工業,高雄市橋頭區芋林路299號,7926511,孫正強,吳居諺,孫正強,董事長,吳居諺,07-6125899,19841121,19990506,新台幣                 10.0000元,411358690,0,0,1,兆豐證券股份有限公司,02-33930898,台北市忠孝東路二段95號1樓、8樓,資誠聯合會計師事務所,林姿妤,劉子猛,OFCO　,"NO.299,YU-LIN ROAD, CHIAO-TOU HSIANG,KAOHSIUNG COUNTY 825 TAIWAN, R.O.C.",07-6125885,mei-yu@ofco.com.tw,www.ofco.com.tw,上櫃,螺栓、螺絲、螺帽、華司及其他金屬材料之製造、加工、銷售,1999/05/06
1322,109/10/25,5013,強新,－ ,鋼鐵工業,台南市722佳里區海澄里萊芊寮12-19號,84703335,吳玉堂,方聰偉,吳孟縈,副總經理,方聰偉,06-7263311,19931125,20000508,新台幣                 10.0000元,1334160000,0,0,1,中國信託商業銀行代理部,02-66365566,台北市100重慶南路一段83號6樓,勤業眾信聯合會計師事務所,李季珍,廖鴻儒,NEW BEST,"NO.12-19 LAI GUAN LIAU, CHIA LIE DIST.,TAINAN CITY TAIWAN R.O.C.",06-7263300,newbest@ms25.hinet.net,www.newbest.com.tw,上櫃,盤元、不鏽鋼盤元、黑鐵絲、五金線材、螺絲、螺帽線材、不鏽鋼線材、鍍鋅鋼線、鐵釘、鐵板、不鏽鋼板之製造、加工及買賣業務、機械設備製造及製造輸出業、國際貿易業。,2000/05/08
1323,109/10/25,5014,建錩,－ ,鋼鐵工業,桃園市大園區田心里大觀路178號,43912787,李慶柏,李慶柏,陳青嵐,稽核室副總,徐蘭英,(03)385-6985,19830728,20010215,新台幣                 10.0000元,1653330540,0,0,1,台新國際商業銀行股務代理部,(02)2504-8125,台北市建國北路一段96號地下一樓,資誠聯合會計師事務所,李燕娜,吳偉豪,CCI　　,"No.178, Ta Guan Rd.,  Tayuan Dist,  Taoyuan City, TaiwanTaoyuan City, Taiwan R.O.C",(03)385-6975,personnel@chainchon.com.tw,global.chainchon.com,上櫃,止滑板、不銹鋼板、不銹鋼圓條、不銹鋼管、角鐵、槽鐵,2001/02/15
1324,109/10/25,5015,華祺,－ ,鋼鐵工業,桃園市中壢區松江北路29號,12494555,葉明彥,張順立,張順立,總經理,游淑齡,03-4511493,19840522,20001215,新台幣                 10.0000元,606391890,0,0,1,凱基證券股份有限公司,02-23892999,台北市重慶南路一段2號5樓,惠眾聯合會計師事務所,林欣如,盧聯生,RODEX　　,"NO. 29, SUNG  CHIANG  NORTH  ROAD　CHUNG LI  IND. PARK, TAIWAN  R.O.C.　　",03-4622317,jack@rodex.com.tw,www.rodex.com.tw,上櫃,不銹鋼螺絲不銹鋼線材,2000/12/15
1325,109/10/25,5016,松和,－ ,鋼鐵工業,南投市南崗工業區南崗三路61號,85611896,林廷芳,李金南,吳蕙如,協理,張達夫,049-2253551,19720915,20010305,新台幣                 10.0000元,496220760,0,0,1,台新國際商業銀行股務代理部,02-25048125,台北市建國北路一段96號地下一樓,安永聯合會計師事務所,陳明宏,涂清淵,Song Ho,"61,NAN-KONG 3 ROAD, NAN TOU CITY　　NAN TOU HSIEN, TAIWAN, R.O.C.　　",049-2253395,mis.songho@msa.hinet.net,http://www.songho.com,上櫃,鋼纜之生產銷售鋼線之生產銷售棒鋼之生產銷售,2001/03/05
1326,109/10/25,5102,富強,－ ,橡膠工業,彰化縣員林市中央里柳橋路2段285號,59743302,蔡文順,蔡文順,蔡武穎,副總經理,蘇鈺雅,04-8323161,19651101,20001027,新台幣                 10.0000元,640850670,0,0,1,第一金證券股份有限公司,02-2563-5711,台北市大安區安和路一段27號六樓,國富浩華聯合會計師事務所,邵朝彬,楊貞瑜,FU CHIAN　,"No.285,Sec. 2, Liu-Qiao Rd.,Yuan-Lin City, Chang-Hua County, Taiwan",04-8354754,service@fuchian.com.tw,www.fuchian.com.tw,上櫃,各種橡膠製品及有關五金、零件之加工買賣各種輪胎之翻修加工買賣前各項有關產品之進出口貿易業務,2000/10/27
1327,109/10/25,5201,凱衛,－ ,資訊服務業,台北市松山區光復北路11巷35號5樓,21261212,曾正哲,曾正哲,許進順,總經理室副總,曾玉君,(02)2528-1335,19850522,20001012,新台幣                 10.0000元,306746000,0,0,1,元富證券股份有限公司,02-27686668,台北市松山區光復北路11巷35號B1,正風聯合會計師事務所,徐素琴,賴家裕,KWAY,"5F., No.35, Ln. 11, Guangfu N. Rd., Songshan Dist.　　Taipei 105, Taiwan, R.O.C.",(02)2528-1877,daphine@mail.kway.com.tw,WWW.KWAY.COM.TW,上櫃,軟硬體系統整合收入勞務及維修收入授權收入,2000/10/12
1328,109/10/25,5202,力新,－ ,資訊服務業,台北市114內湖區新湖一路128巷15號6樓,22645531,林榮生,黃銘達,譚仲民,董事長特別助理,林伯純,(02)7721-0111,19870930,20001018,新台幣                 10.0000元,590940000,0,0,1,群益金鼎證券股份有限公司,(02)2702-3999,台北市敦化南路二段97號地下2樓,勤業眾信聯合會計師事務所,林文欽,劉建良,NewSoft　　,"6F, No.15 Ln. 128, Xinhu 1st Rd., Neihu District,Taipei, Taiwan, R.O.C　　",(02)7721-2001,contactus@newsoft.com.tw,www.newsoft.com.tw,上櫃,影像視訊及多媒體軟體開發與銷售,2000/10/18
1329,109/10/25,5205,中茂,－ ,其他電子業,台北市內湖區內湖路1段396號3樓之1,23533366,高承本,詹益國,詹益國,總經理,卓立,(02)2658-7118,19891213,20010514,新台幣                 10.0000元,185052000,8795200,0,1,群益金鼎證券股份有限公司,02-27023999,台北市大安區敦化南路二段97號B2,眾智聯合會計師事務所,游佩靜,莊雯秋,TWGET　　,"3F.-1, No.396, Sec. 1, Neihu Rd., Neihu Dist., Taipei CityTaipei City  , Taiwan, R.O.C.　",(02)26587119,twget@twget.com.tw,http://www.twget.com.tw/,上櫃,LCD顯示器、Audio產品、電子零組件工具軟體ERP應用軟體及其他,2001/05/14
1330,109/10/25,5206,坤悅,－ ,建材營造,台中市西屯區市政路402號19樓之二,4738240,陳丕岳,陳丕岳,賴志龍,協理,尤燕莉,(04)2258-8809,19751006,20011008,新台幣                 10.0000元,1559250000,0,0,1,台新國際商業銀行股份有限公司,(02)2504-8125,台北市建國北路1段96號地下一樓,建智聯合會計師事務所,黃祥穎,廖年傑,Kunyue,"19F.-2,  No. 402, Shizheng Rd,Taichung City, Taiwan R.O.C.",(04)2258-6252,service@kunyue.com.tw,www.kunyue.com.tw,上櫃,房地產開發,2001/10/08
1331,109/10/25,5209,新鼎,－ ,資訊服務業,台北市中山北路六段89號10樓,22619999,周鐘麒,陳振欽,許郁婉暫代,經理,許郁婉,(02)2785-3839,19870803,20020225,新台幣                 10.0000元,235372500,0,0,1,凱基證券股份有限公司,(02)2389-2999,台北市重慶南路一段二號5樓,資誠聯合會計師事務所,葉翠苗,林佳鴻,CTCI ASI,"10FL., 89, Sec. 6, Zhongshan North Rd.Taipei 11155, Taiwan, R.O.C.",(02)28357412,CTCI.ASI.Spokesman@ctci.com,www.asi.ctci.com,上櫃,各項控制系統軟硬體之分項與整體之可行性研究、規劃、設計、採購軟硬體組合.監造.安裝.校測.試車.維護及操作等。電腦軟.硬體.儀器之進口代理及銷售。,2002/02/25
1332,109/10/25,5210,寶碩,－ ,資訊服務業,台北市松山區八德路二段358號六樓之一,23131763,白介宇,劉國安,徐志文,行政管理處副總經理,成心儀,02-8791-9799,19881123,20020425,新台幣                 10.0000元,621777790,0,0,1,台新國際商業銀行股務代理部,(02)25048125,台北市建國北路一段96號地下一樓,國富浩華聯合會計師事務所,蕭英嘉,邱繼盛,APEX,"6F.-1, No.358, Sec. 2, Bade Rd., Songshan Dist.Taipei City, Taiwan (R.O.C.)",02-8791-9366,jameshsu@mail.apex.com.tw,http://www.apex.com.tw,上櫃,資訊軟體服務業電子資訊供應服務業系統整合服務業,2002/04/25
1333,109/10/25,5211,蒙恬,－ ,資訊服務業,(30071)新竹市光復路二段二巷47號7樓,86287778,蔡義泰,蔡義泰,詹榮泉,財務長,郭維新,03-5722691,19910924,20021223,新台幣                 10.0000元,320247270,0,0,1,台新國際商業銀行股務代理部,02-2504-8125,台北市建國北路一段96號地下一樓,勤業眾信會計師事務所,高逸欣,陳明煇,Penpower,"7 F,No.47 Lane 2,Sec. 2,Kuang-Fu Rd.Hsinchu, Taiwan R.O.C",03-5716243,spokesman@penpower.com.tw,http://www.penpower.com.tw,上櫃,電腦軟體之設計維護及買賣業務。電腦及其週邊設備之設計、製造、修理及買賣業務。一般進出口貿易業務。,2002/12/23
1334,109/10/25,5212,凌網,－ ,資訊服務業,新竹縣竹北市台元一街8號5樓之6,16541333,賴洋助,賴洋助,羅玉瑩,財務部經理,鄭安如,03-5601296,19980703,20030324,新台幣                 10.0000元,346330000,0,0,1,元富證券股份有限公司,02-27686668,台北市松山區光復北路11巷35號地下一樓,安永聯合會計師事務所,郭紹彬,陳智忠,HYWEB　　,"5F.-6, No.8, Taiyuan 1st St.,Zhubei City, Hsinchu County 302, Taiwan",03-5601297,judylo@hyweb.com.tw,www.hyweb.com.tw,上櫃,專案軟體服務圖書館軟體及電子書銷售服務金融軟體服務,2003/03/24
1335,109/10/25,5213,亞昕,－ ,建材營造,台北市松山區敦化南路一段25號12樓,89961389,姚連地,姚政岳,沈政毅,管理部副總,萬書吟,02-2578-9393,19950116,20030424,新台幣                 10.0000元,3461954320,0,0,1,兆豐證券股份有限公司,02-3393-0898,台北市忠孝東路二段95號1樓,安侯建業聯合會計師事務所,張淑瑩,池世欽,YeaShin,"12F., No.25, Sec. 1, Dunhua S. Rd., Songshan District, Taipei City 105, TaiwanTaipei,Taiwan,R.O.C.　　",02-2579-1515,www.yeashin.com.tw,www.yeashin.com.tw,上櫃,住宅及大樓開發租售,2003/04/24
